{"nroMarea":1,"buqueName":"VALERIA DEL ATLÁNTICO","obsName":"Glavina Walter Alejandro","especieStr":"MERLUZA AUSTRAL","estadoStr":"REALIZADA","zarpadaEstimada":"3/1/2025","diasEstimados":60,"diasZonaAustral":32,"empresa":"ESTREMAR","etapas":[{"nroEtapa":1,"rangoRaw":"03/01/25 al 03/0/25","fecha_zarpada":"2025-01-03T03:00:00.000Z","fecha_arribo":"2025-01-03T03:00:00.000Z","valido":true}]}
{"nroMarea":2,"buqueName":"ARGENOVA XXI","obsName":"Piriz Cristian Oscar","especieStr":"MERLUZA AUSTRAL","estadoStr":"REALIZADA","zarpadaEstimada":"3/1/2025","diasEstimados":60,"diasZonaAustral":23,"empresa":"ARGENOVA","etapas":[{"nroEtapa":1,"rangoRaw":"28/01/25 al 28/01/25","fecha_zarpada":"2025-01-28T03:00:00.000Z","fecha_arribo":"2025-01-28T03:00:00.000Z","valido":true}]}
{"nroMarea":3,"buqueName":"ATLANTIC EXPRESS","obsName":"Reinaga Teresa Beatriz","especieStr":"CENTOLLA","estadoStr":"REALIZADA","zarpadaEstimada":"3/1/2025","diasEstimados":30,"diasZonaAustral":0,"empresa":"WANCHESE ARGENTINA","etapas":[{"nroEtapa":1,"rangoRaw":"03/01/25 al 04/03/25","fecha_zarpada":"2025-01-03T03:00:00.000Z","fecha_arribo":"2025-03-04T03:00:00.000Z","valido":true}]}
{"nroMarea":4,"buqueName":"DON PEDRO","obsName":"Staneff Juan Manuel","especieStr":"MERLUZA","estadoStr":"REALIZADA","zarpadaEstimada":"12/1/2025","diasEstimados":30,"diasZonaAustral":4,"empresa":"PEDRO MOSCUZZA E HIJO","etapas":[{"nroEtapa":1,"rangoRaw":"11/01/25 al 07/03/25","fecha_zarpada":"2025-01-11T03:00:00.000Z","fecha_arribo":"2025-03-07T03:00:00.000Z","valido":true}]}
{"nroMarea":5,"buqueName":"GEMINIS","obsName":"Spagnuolo Rey Leonardo Luis","especieStr":"MERLUZA","estadoStr":"REALIZADA","zarpadaEstimada":"8/1/2025","diasEstimados":30,"diasZonaAustral":0,"empresa":"PESQUERA GEMINIS","etapas":[{"nroEtapa":1,"rangoRaw":"07/01/25 al 28/01/25","fecha_zarpada":"2025-01-07T03:00:00.000Z","fecha_arribo":"2025-01-28T03:00:00.000Z","valido":true}]}
{"nroMarea":6,"buqueName":"DON LUIS I","obsName":"Cerrina Cristian Emmanuel","especieStr":"CALAMAR","estadoStr":"REALIZADA","zarpadaEstimada":"9/1/2025","diasEstimados":30,"diasZonaAustral":0,"empresa":"PESQUERA CERES","etapas":[{"nroEtapa":1,"rangoRaw":"08/01/25 al 02/02/25","fecha_zarpada":"2025-01-08T03:00:00.000Z","fecha_arribo":"2025-02-02T03:00:00.000Z","valido":true}]}
{"nroMarea":7,"buqueName":"SOHO MARU Nº 58","obsName":"Miranda Pablo Julian","especieStr":"CALAMAR","estadoStr":"REALIZADA","zarpadaEstimada":"7/1/2025","diasEstimados":30,"diasZonaAustral":0,"empresa":"ARGENOVA","etapas":[{"nroEtapa":1,"rangoRaw":"07/01/25 al 30/01/25","fecha_zarpada":"2025-01-07T03:00:00.000Z","fecha_arribo":"2025-01-30T03:00:00.000Z","valido":true}]}
{"nroMarea":8,"buqueName":"VIRGEN MARIA","obsName":"Nadal Claudio Alberto","especieStr":"MERLUZA","estadoStr":"REALIZADA","zarpadaEstimada":"9/1/2025","diasEstimados":30,"diasZonaAustral":0,"empresa":"LUIS SOLIMENO","etapas":[{"nroEtapa":1,"rangoRaw":"11/01/25 al 19/01/25","fecha_zarpada":"2025-01-11T03:00:00.000Z","fecha_arribo":"2025-01-19T03:00:00.000Z","valido":true},{"nroEtapa":2,"rangoRaw":"22/01/25 al 29/01/25","fecha_zarpada":"2025-01-22T03:00:00.000Z","fecha_arribo":"2025-01-29T03:00:00.000Z","valido":true},{"nroEtapa":3,"rangoRaw":"31/01/25 al 02/02/25","fecha_zarpada":"2025-01-31T03:00:00.000Z","fecha_arribo":"2025-02-02T03:00:00.000Z","valido":true}]}
{"nroMarea":9,"buqueName":"MISS TIDE","obsName":"Di Tullio Daniel Alejandro","especieStr":"VIEIRA","estadoStr":"REALIZADA","zarpadaEstimada":"6/1/2025","diasEstimados":30,"diasZonaAustral":0,"empresa":"WANCHESE ARGENTINA","etapas":[{"nroEtapa":1,"rangoRaw":"06/01/25 al 07/02/25","fecha_zarpada":"2025-01-06T03:00:00.000Z","fecha_arribo":"2025-02-07T03:00:00.000Z","valido":true}]}
{"nroMarea":10,"buqueName":"ATLANTIC SURF III","obsName":"Bargas Peña Raul Bernardo","especieStr":"VIEIRA","estadoStr":"REALIZADA","zarpadaEstimada":"11/1/2025","diasEstimados":30,"diasZonaAustral":0,"empresa":"GLACIAR PESQUERA","etapas":[{"nroEtapa":1,"rangoRaw":"13/01/25 al 24/02/25","fecha_zarpada":"2025-01-13T03:00:00.000Z","fecha_arribo":"2025-02-24T03:00:00.000Z","valido":true}]}
{"nroMarea":11,"buqueName":"MATEO I","obsName":"Martinez Tecco Luis Gabriel","especieStr":"CALAMAR","estadoStr":"REALIZADA","zarpadaEstimada":"8/1/2025","diasEstimados":30,"diasZonaAustral":0,"empresa":"FOOD ARTZ S.A.","etapas":[{"nroEtapa":1,"rangoRaw":"08/01/25 al 02/02/25","fecha_zarpada":"2025-01-08T03:00:00.000Z","fecha_arribo":"2025-02-02T03:00:00.000Z","valido":true}]}
{"nroMarea":12,"buqueName":"ERIN BRUCE II","obsName":"Villalba Durbal","especieStr":"VIEIRA","estadoStr":"REALIZADA","zarpadaEstimada":"9/1/2025","diasEstimados":30,"diasZonaAustral":0,"empresa":"WANCHESE ARGENTINA","etapas":[{"nroEtapa":1,"rangoRaw":"09/01/25 al 16/02/25","fecha_zarpada":"2025-01-09T03:00:00.000Z","fecha_arribo":"2025-02-16T03:00:00.000Z","valido":true}]}
{"nroMarea":13,"buqueName":"PIONEROS","obsName":"Alvarez Gianfranco","especieStr":"CENTOLLA","estadoStr":"REALIZADA","zarpadaEstimada":"9/1/2025","diasEstimados":30,"diasZonaAustral":0,"empresa":"FOOD PARTNERS PATAGONIA","etapas":[{"nroEtapa":1,"rangoRaw":"08/01/25 al 17/02/25","fecha_zarpada":"2025-01-08T03:00:00.000Z","fecha_arribo":"2025-02-17T03:00:00.000Z","valido":true}]}
{"nroMarea":14,"buqueName":"NATALIA","obsName":"Monterisi María Laura","especieStr":"CALAMAR","estadoStr":"REALIZADA","zarpadaEstimada":"9/1/2025","diasEstimados":30,"diasZonaAustral":0,"empresa":"PEDRO MOSCUZZA E HIJO","etapas":[{"nroEtapa":1,"rangoRaw":"09/01/25 al 13/02/25","fecha_zarpada":"2025-01-09T03:00:00.000Z","fecha_arribo":"2025-02-13T03:00:00.000Z","valido":true}]}
{"nroMarea":15,"buqueName":"ATREVIDO","obsName":"Marchiori Diego Sebastian","especieStr":"MERLUZA","estadoStr":"REALIZADA","zarpadaEstimada":"11/1/2025","diasEstimados":30,"diasZonaAustral":0,"empresa":"PESQUERA VERAZ","etapas":[{"nroEtapa":1,"rangoRaw":"12/01/25 al 19/01/25","fecha_zarpada":"2025-01-12T03:00:00.000Z","fecha_arribo":"2025-01-19T03:00:00.000Z","valido":true},{"nroEtapa":2,"rangoRaw":"20/01/25 al 26/01/25","fecha_zarpada":"2025-01-20T03:00:00.000Z","fecha_arribo":"2025-01-26T03:00:00.000Z","valido":true},{"nroEtapa":3,"rangoRaw":"28/01/25 al 06/02/25","fecha_zarpada":"2025-01-28T03:00:00.000Z","fecha_arribo":"2025-02-06T03:00:00.000Z","valido":true},{"nroEtapa":4,"rangoRaw":"07/02/25 al 12/02/25","fecha_zarpada":"2025-02-07T03:00:00.000Z","fecha_arribo":"2025-02-12T03:00:00.000Z","valido":true}]}
{"nroMarea":16,"buqueName":"CAPESANTE","obsName":"Coppa Juan José","especieStr":"VIEIRA","estadoStr":"REALIZADA","zarpadaEstimada":"16/1/2025","diasEstimados":30,"diasZonaAustral":11,"empresa":"GLACIAR PESQUERA","etapas":[{"nroEtapa":1,"rangoRaw":"17/01/25 AL 01/03/25","fecha_zarpada":"2025-01-17T03:00:00.000Z","fecha_arribo":"2025-03-01T03:00:00.000Z","valido":true}]}
{"nroMarea":17,"buqueName":"HUYU 962","obsName":"Challier Johnatan","especieStr":"CALAMAR","estadoStr":"REALIZADA","zarpadaEstimada":"17/1/2025","diasEstimados":30,"diasZonaAustral":0,"empresa":"ALTAMARE S.AS","etapas":[{"nroEtapa":1,"rangoRaw":"16/01/25 AL 18/01/25","fecha_zarpada":"2025-01-16T03:00:00.000Z","fecha_arribo":"2025-01-18T03:00:00.000Z","valido":true}]}
{"nroMarea":18,"buqueName":"HUYU 961","obsName":"Matte Casietto Luciano","especieStr":"CALAMAR","estadoStr":"REALIZADA","zarpadaEstimada":"17/1/2025","diasEstimados":30,"diasZonaAustral":0,"empresa":"ALTAMARE S.AS","etapas":[{"nroEtapa":1,"rangoRaw":"16/01/25 AL 11/03/25","fecha_zarpada":"2025-01-16T03:00:00.000Z","fecha_arribo":"2025-03-11T03:00:00.000Z","valido":true}]}
{"nroMarea":19,"buqueName":"TANGO I","obsName":"Retamar Mendez Oriana","especieStr":"CENTOLLA","estadoStr":"REALIZADA","zarpadaEstimada":"28/1/2025","diasEstimados":30,"diasZonaAustral":0,"empresa":"BENTONICOS DE ARGENTINA","etapas":[{"nroEtapa":1,"rangoRaw":"27/01/25 AL 07/02/25","fecha_zarpada":"2025-01-27T03:00:00.000Z","fecha_arribo":"2025-02-07T03:00:00.000Z","valido":true}]}
{"nroMarea":20,"buqueName":"DON LUIS I","obsName":"Cerrina Cristian Emmanuel","especieStr":"CALAMAR","estadoStr":"REALIZADA","zarpadaEstimada":"28/1/2025","diasEstimados":30,"diasZonaAustral":0,"empresa":"GIORNO","etapas":[{"nroEtapa":1,"rangoRaw":"03/02/25 AL 11/03/25","fecha_zarpada":"2025-02-03T03:00:00.000Z","fecha_arribo":"2025-03-11T03:00:00.000Z","valido":true}]}
{"nroMarea":21,"buqueName":"DUKAT","obsName":"Aguilar Alexia","especieStr":"CENTOLLA","estadoStr":"REALIZADA","zarpadaEstimada":"4/2/2025","diasEstimados":30,"diasZonaAustral":0,"empresa":"CRUSTACEOS DEL SUR S.A","etapas":[{"nroEtapa":1,"rangoRaw":"03/02/25 AL 12/03/25","fecha_zarpada":"2025-02-03T03:00:00.000Z","fecha_arribo":"2025-03-12T03:00:00.000Z","valido":true}]}
{"nroMarea":22,"buqueName":"HOYO MARU 37","obsName":"Cano Gustavo","especieStr":"CALAMAR","estadoStr":"REALIZADA","zarpadaEstimada":"1/2/2025","diasEstimados":30,"diasZonaAustral":0,"empresa":"ARGENOVA","etapas":[{"nroEtapa":1,"rangoRaw":"31/01/25 AL 24/03/25","fecha_zarpada":"2025-01-31T03:00:00.000Z","fecha_arribo":"2025-03-24T03:00:00.000Z","valido":true}]}
{"nroMarea":23,"buqueName":"ARBUMASA XXVIII","obsName":"Challier Johnatan","especieStr":"CALAMAR","estadoStr":"REALIZADA","zarpadaEstimada":"28/1/2025","diasEstimados":30,"diasZonaAustral":0,"empresa":"ARBUMASA S.A","etapas":[{"nroEtapa":1,"rangoRaw":"28/01/25 AL 23/02/25","fecha_zarpada":"2025-01-28T03:00:00.000Z","fecha_arribo":"2025-02-23T03:00:00.000Z","valido":true},{"nroEtapa":2,"rangoRaw":"25/02/25 AL 06/04/25","fecha_zarpada":"2025-02-25T03:00:00.000Z","fecha_arribo":"2025-04-06T03:00:00.000Z","valido":true}]}
{"nroMarea":24,"buqueName":"ARGENOVA XXI","obsName":"Piriz Cristian Oscar","especieStr":"MERLUZA AUSTRAL","estadoStr":"REALIZADA","zarpadaEstimada":"31/1/2025","diasEstimados":30,"diasZonaAustral":22,"empresa":"ARGENOVA","etapas":[{"nroEtapa":1,"rangoRaw":"29/01/25  AL 23/02/25","fecha_zarpada":"2025-01-29T03:00:00.000Z","fecha_arribo":"2025-02-23T03:00:00.000Z","valido":true}]}
{"nroMarea":25,"buqueName":"TANGO II","obsName":"Gorosito Diego","especieStr":"CENTOLLA","estadoStr":"REALIZADA","zarpadaEstimada":"1/2/2025","diasEstimados":30,"diasZonaAustral":0,"empresa":"BENTONICOS DE ARGENTINA","etapas":[{"nroEtapa":1,"rangoRaw":"30/01/25 AL 27/02/25","fecha_zarpada":"2025-01-30T03:00:00.000Z","fecha_arribo":"2025-02-27T03:00:00.000Z","valido":true}]}
{"nroMarea":26,"buqueName":"VENTARRON 1º","obsName":"Prado Escobar Leonardo","especieStr":"MERLUZA","estadoStr":"REALIZADA","zarpadaEstimada":"2/2/2025","diasEstimados":30,"diasZonaAustral":0,"empresa":"GIORNO","etapas":[{"nroEtapa":1,"rangoRaw":"03/02/25 AL 10/03/25","fecha_zarpada":"2025-02-03T03:00:00.000Z","fecha_arribo":"2025-03-10T03:00:00.000Z","valido":true}]}
{"nroMarea":27,"buqueName":"MINTA","obsName":"Garcia Gisele","especieStr":"CALAMAR","estadoStr":"REALIZADA","zarpadaEstimada":"31/1/2025","diasEstimados":30,"diasZonaAustral":0,"empresa":"CHIARPESCA","etapas":[{"nroEtapa":1,"rangoRaw":"30/01/25 AL 11/03/25","fecha_zarpada":"2025-01-30T03:00:00.000Z","fecha_arribo":"2025-03-11T03:00:00.000Z","valido":true}]}
{"nroMarea":28,"buqueName":"ECHIZEN MARU","obsName":"Caballero Nicolas Agustin","especieStr":"CALAMAR","estadoStr":"REALIZADA","zarpadaEstimada":"6/2/2025","diasEstimados":60,"diasZonaAustral":0,"empresa":"PESANTAR","etapas":[{"nroEtapa":1,"rangoRaw":"05/02/25 AL 09/04/25","fecha_zarpada":"2025-02-05T03:00:00.000Z","fecha_arribo":"2025-04-09T03:00:00.000Z","valido":true}]}
{"nroMarea":29,"buqueName":"SIRIUS II","obsName":"Vera Héctor Eduardo","especieStr":"MERLUZA","estadoStr":"REALIZADA","zarpadaEstimada":"3/2/2025","diasEstimados":30,"diasZonaAustral":0,"empresa":"EL MARISCO","etapas":[{"nroEtapa":1,"rangoRaw":"07/02/25 AL 22/02/25","fecha_zarpada":"2025-02-07T03:00:00.000Z","fecha_arribo":"2025-02-22T03:00:00.000Z","valido":true}]}
{"nroMarea":30,"buqueName":"VALERIA DEL ATLÁNTICO","obsName":"Staneff Rotela Nicolas Facundo","especieStr":"MERLUZA AUSTRAL","estadoStr":"REALIZADA","zarpadaEstimada":"12/2/2025","diasEstimados":30,"diasZonaAustral":83,"empresa":"ESTREMAR","etapas":[{"nroEtapa":1,"rangoRaw":"11/2/2025 AL 7/5/2025","fecha_zarpada":"2025-02-11T03:00:00.000Z","fecha_arribo":"2025-05-07T03:00:00.000Z","valido":true}]}
{"nroMarea":31,"buqueName":"MISS TIDE","obsName":"Garcia Sebastian","especieStr":"VIEIRA","estadoStr":"REALIZADA","zarpadaEstimada":"2/2/2025","diasEstimados":30,"diasZonaAustral":0,"empresa":"WANCHESE ARGENTINA","etapas":[{"nroEtapa":1,"rangoRaw":"12/02/25 AL 20/03/25","fecha_zarpada":"2025-02-12T03:00:00.000Z","fecha_arribo":"2025-03-20T03:00:00.000Z","valido":true}]}
{"nroMarea":32,"buqueName":"TAI AN","obsName":"Noale Claudio","especieStr":"MERLUZA AUSTRAL","estadoStr":"REALIZADA","zarpadaEstimada":"19/2/2025","diasEstimados":60,"diasZonaAustral":0,"empresa":"PRODESUR","etapas":[{"nroEtapa":1,"rangoRaw":"19/02/25 AL 13/04/25","fecha_zarpada":"2025-02-19T03:00:00.000Z","fecha_arribo":"2025-04-13T03:00:00.000Z","valido":true}]}
{"nroMarea":33,"buqueName":"ATREVIDO","obsName":"Miranda Pablo Julian","especieStr":"MERLUZA","estadoStr":"REALIZADA","zarpadaEstimada":"14/2/2025","diasEstimados":30,"diasZonaAustral":0,"empresa":"PESQUERA VERAZ","etapas":[{"nroEtapa":1,"rangoRaw":"18/02/25 AL 25/02/25","fecha_zarpada":"2025-02-18T03:00:00.000Z","fecha_arribo":"2025-02-25T03:00:00.000Z","valido":true}]}
{"nroMarea":34,"buqueName":"ATLANTIC SURF III","obsName":"Martinez Tecco Luis Gabriel","especieStr":"VIEIRA","estadoStr":"REALIZADA","zarpadaEstimada":"27/2/2025","diasEstimados":30,"diasZonaAustral":0,"empresa":"GLACIAR PESQUERA","etapas":[{"nroEtapa":1,"rangoRaw":"27/2/25 AL 07/04/25","fecha_zarpada":"2025-02-27T03:00:00.000Z","fecha_arribo":"2025-04-07T03:00:00.000Z","valido":true}]}
{"nroMarea":35,"buqueName":"ARGENOVA XXI","obsName":"Villalba Durbal","especieStr":"MERLUZA AUSTRAL","estadoStr":"REALIZADA","zarpadaEstimada":"25/2/2025","diasEstimados":30,"diasZonaAustral":0,"empresa":"ARGENOVA","etapas":[{"nroEtapa":1,"rangoRaw":"24/02/25 AL 31/03/25","fecha_zarpada":"2025-02-24T03:00:00.000Z","fecha_arribo":"2025-03-31T03:00:00.000Z","valido":true}]}
{"nroMarea":36,"buqueName":"ERIN BRUCE II","obsName":"Corti Camila","especieStr":"VIEIRA","estadoStr":"REALIZADA","zarpadaEstimada":"20/2/2025","diasEstimados":30,"diasZonaAustral":0,"empresa":"WANCHESE ARGENTINA","etapas":[{"nroEtapa":1,"rangoRaw":"21/02/25 AL 02/04/25","fecha_zarpada":"2025-02-21T03:00:00.000Z","fecha_arribo":"2025-04-02T03:00:00.000Z","valido":true}]}
{"nroMarea":37,"buqueName":"CHIYO MARU Nº 3","obsName":"Di Tullio Daniel Alejandro","especieStr":"CENTOLLA","estadoStr":"REALIZADA","zarpadaEstimada":"21/2/2025","diasEstimados":30,"diasZonaAustral":29,"empresa":"CRUSTACEOS DEL SUR S.A","etapas":[{"nroEtapa":1,"rangoRaw":"21/02/25 AL 28/03/25","fecha_zarpada":"2025-02-21T03:00:00.000Z","fecha_arribo":"2025-03-28T03:00:00.000Z","valido":true}]}
{"nroMarea":38,"buqueName":"ATLANTIC EXPRESS","obsName":"Silvester Eduardo","especieStr":"CENTOLLA","estadoStr":"REALIZADA","zarpadaEstimada":"5/3/2025","diasEstimados":30,"diasZonaAustral":0,"empresa":"WANCHESE ARGENTINA","etapas":[{"nroEtapa":1,"rangoRaw":"06/03/25 AL 26/03/25","fecha_zarpada":"2025-03-06T03:00:00.000Z","fecha_arribo":"2025-03-26T03:00:00.000Z","valido":true}]}
{"nroMarea":39,"buqueName":"TANGO I","obsName":"Pereyra Nicolas","especieStr":"CENTOLLA","estadoStr":"CANCELADA","zarpadaEstimada":"6/3/2025","diasEstimados":30,"diasZonaAustral":null,"empresa":"BENTONICOS DE ARGENTINA","etapas":[]}
{"nroMarea":40,"buqueName":"CAPESANTE","obsName":"Coppa Juan José","especieStr":"VIEIRA","estadoStr":"REALIZADA","zarpadaEstimada":"6/3/2025","diasEstimados":30,"diasZonaAustral":6,"empresa":"GLACIAR PESQUERA","etapas":[{"nroEtapa":1,"rangoRaw":"06/03/25 AL 13/04/25","fecha_zarpada":"2025-03-06T03:00:00.000Z","fecha_arribo":"2025-04-13T03:00:00.000Z","valido":true}]}
{"nroMarea":41,"buqueName":"AURORA","obsName":"Godoy Maximiliano Adrian","especieStr":"CALAMAR","estadoStr":"REALIZADA","zarpadaEstimada":"3/3/2025","diasEstimados":30,"diasZonaAustral":0,"empresa":"FOOD ARTS S.A","etapas":[{"nroEtapa":1,"rangoRaw":"07/03/25 AL 07/04/25","fecha_zarpada":"2025-03-07T03:00:00.000Z","fecha_arribo":"2025-04-07T03:00:00.000Z","valido":true}]}
{"nroMarea":42,"buqueName":"TOZUDO","obsName":"Rodriguez Fulco Estanislao","especieStr":"P.ABADEJO","estadoStr":"REALIZADA","zarpadaEstimada":"7/3/2025","diasEstimados":30,"diasZonaAustral":0,"empresa":"TOZUDO","etapas":[{"nroEtapa":1,"rangoRaw":"11/03/25 AL 18/03/25","fecha_zarpada":"2025-03-11T03:00:00.000Z","fecha_arribo":"2025-03-18T03:00:00.000Z","valido":true},{"nroEtapa":2,"rangoRaw":"21/03/25 AL 28/03/25","fecha_zarpada":"2025-03-21T03:00:00.000Z","fecha_arribo":"2025-03-28T03:00:00.000Z","valido":true}]}
{"nroMarea":43,"buqueName":"MARIANELA","obsName":"Mazzei Alejandro José","especieStr":"P.ABADEJO","estadoStr":"REALIZADA","zarpadaEstimada":"7/3/2025","diasEstimados":30,"diasZonaAustral":0,"empresa":"PESQUERA SIEMPRE GAUCHO","etapas":[{"nroEtapa":1,"rangoRaw":"11/03/25 AL 16/03/25","fecha_zarpada":"2025-03-11T03:00:00.000Z","fecha_arribo":"2025-03-16T03:00:00.000Z","valido":true},{"nroEtapa":2,"rangoRaw":"17/03/25 AL 28/03/25","fecha_zarpada":"2025-03-17T03:00:00.000Z","fecha_arribo":"2025-03-28T03:00:00.000Z","valido":true}]}
{"nroMarea":44,"buqueName":"MISS PATAGONIA","obsName":"Glavina Walter Alejandro","especieStr":"P.ABADEJO","estadoStr":"REALIZADA","zarpadaEstimada":"7/3/2025","diasEstimados":30,"diasZonaAustral":0,"empresa":"LOBA PESQUERA","etapas":[{"nroEtapa":1,"rangoRaw":"12/03/25 AL 17/03/25","fecha_zarpada":"2025-03-12T03:00:00.000Z","fecha_arribo":"2025-03-17T03:00:00.000Z","valido":true},{"nroEtapa":2,"rangoRaw":"18/03/25 AL 29/03/25","fecha_zarpada":"2025-03-18T03:00:00.000Z","fecha_arribo":"2025-03-29T03:00:00.000Z","valido":true}]}
{"nroMarea":45,"buqueName":"DON GAETANO","obsName":"Miranda Pablo Julian","especieStr":"P.ABADEJO","estadoStr":"REALIZADA","zarpadaEstimada":"7/3/2025","diasEstimados":30,"diasZonaAustral":0,"empresa":"ROMFIOC S.R.L","etapas":[{"nroEtapa":1,"rangoRaw":"11/03/25 AL 20/03/25","fecha_zarpada":"2025-03-11T03:00:00.000Z","fecha_arribo":"2025-03-20T03:00:00.000Z","valido":true},{"nroEtapa":2,"rangoRaw":"22/03/25 AL 27/03/25","fecha_zarpada":"2025-03-22T03:00:00.000Z","fecha_arribo":"2025-03-27T03:00:00.000Z","valido":true}]}
{"nroMarea":46,"buqueName":"TESON","obsName":"Alvarez Gianfranco","especieStr":"P.ABADEJO","estadoStr":"REALIZADA","zarpadaEstimada":"7/3/2025","diasEstimados":30,"diasZonaAustral":0,"empresa":"MAREA OPTIMA","etapas":[{"nroEtapa":1,"rangoRaw":"07/03/25 AL 12/03/25","fecha_zarpada":"2025-03-07T03:00:00.000Z","fecha_arribo":"2025-03-12T03:00:00.000Z","valido":true},{"nroEtapa":2,"rangoRaw":"15/03/25 AL 18/03/25","fecha_zarpada":"2025-03-15T03:00:00.000Z","fecha_arribo":"2025-03-18T03:00:00.000Z","valido":true}]}
{"nroMarea":47,"buqueName":"DUKAT","obsName":"Pereyra Nicolas","especieStr":"CENTOLLA","estadoStr":"REALIZADA","zarpadaEstimada":"12/3/2025","diasEstimados":30,"diasZonaAustral":0,"empresa":"CRUSTACEOS DEL SUR S.A","etapas":[{"nroEtapa":1,"rangoRaw":"11/03/25 AL 23/04/25","fecha_zarpada":"2025-03-11T03:00:00.000Z","fecha_arribo":"2025-04-23T03:00:00.000Z","valido":true}]}
{"nroMarea":48,"buqueName":"TALISMAN","obsName":"Gimenez Salinas Gabriel Osvaldo Catriel","especieStr":"CENTOLLA","estadoStr":"REALIZADA","zarpadaEstimada":"12/3/2025","diasEstimados":30,"diasZonaAustral":0,"empresa":"CENTOMAR S.A","etapas":[{"nroEtapa":1,"rangoRaw":"12/03/25 AL 30/04/25","fecha_zarpada":"2025-03-12T03:00:00.000Z","fecha_arribo":"2025-04-30T03:00:00.000Z","valido":true}]}
{"nroMarea":49,"buqueName":"CAROLINA P","obsName":"Staneff Juan Manuel","especieStr":"MERLUZA","estadoStr":"REALIZADA","zarpadaEstimada":"18/3/2025","diasEstimados":30,"diasZonaAustral":27,"empresa":"ESTRELLA PATAGONICA","etapas":[{"nroEtapa":1,"rangoRaw":"17/03/25 AL 25/04/25","fecha_zarpada":"2025-03-17T03:00:00.000Z","fecha_arribo":"2025-04-25T03:00:00.000Z","valido":true}]}
{"nroMarea":50,"buqueName":"NANINA","obsName":"Gorosito Diego","especieStr":"CALAMAR","estadoStr":"REALIZADA","zarpadaEstimada":"22/3/2025","diasEstimados":30,"diasZonaAustral":0,"empresa":"MOSCUZZA","etapas":[{"nroEtapa":1,"rangoRaw":"24/03/25 AL 23/04/25","fecha_zarpada":"2025-03-24T03:00:00.000Z","fecha_arribo":"2025-04-23T03:00:00.000Z","valido":true}]}
{"nroMarea":51,"buqueName":"MISS TIDE","obsName":"Bargas Peña Raul Bernardo","especieStr":"VIEIRA","estadoStr":"REALIZADA","zarpadaEstimada":"24/3/2025","diasEstimados":30,"diasZonaAustral":0,"empresa":"WANCHESE ARGENTINA","etapas":[{"nroEtapa":1,"rangoRaw":"28/03/25 AL 30/04/25","fecha_zarpada":"2025-03-28T03:00:00.000Z","fecha_arribo":"2025-04-30T03:00:00.000Z","valido":true}]}
{"nroMarea":52,"buqueName":"ARGENOVA XXI","obsName":"Aguilar Eduardo Esteban","especieStr":"MERLUZA AUSTRAL","estadoStr":"REALIZADA","zarpadaEstimada":"27/3/2025","diasEstimados":30,"diasZonaAustral":25,"empresa":"ARGENOVA","etapas":[{"nroEtapa":1,"rangoRaw":"1/4/2025 AL 27/4/2025","fecha_zarpada":"2025-04-01T03:00:00.000Z","fecha_arribo":"2025-04-27T03:00:00.000Z","valido":true}]}
{"nroMarea":53,"buqueName":"NATALIA","obsName":"Retamar Mendez Oriana","especieStr":"CALAMAR","estadoStr":"REALIZADA","zarpadaEstimada":"28/3/2025","diasEstimados":30,"diasZonaAustral":0,"empresa":"PEDRO MOSCUZZA E HIJO","etapas":[{"nroEtapa":1,"rangoRaw":"28/3/2025 AL 5/5/2025","fecha_zarpada":"2025-03-28T03:00:00.000Z","fecha_arribo":"2025-05-05T03:00:00.000Z","valido":true}]}
{"nroMarea":54,"buqueName":"ERIN BRUCE II","obsName":"Silvester Eduardo","especieStr":"VIEIRA","estadoStr":"REALIZADA","zarpadaEstimada":"9/4/2025","diasEstimados":30,"diasZonaAustral":0,"empresa":"WANCHESE ARGENTINA","etapas":[{"nroEtapa":1,"rangoRaw":"11/4/2025 AL 17/5/2025","fecha_zarpada":"2025-04-11T03:00:00.000Z","fecha_arribo":"2025-05-17T03:00:00.000Z","valido":true}]}
{"nroMarea":55,"buqueName":"TAI AN","obsName":"Piriz Cristian Oscar","especieStr":"MERLUZA AUSTRAL","estadoStr":"REALIZADA","zarpadaEstimada":"17/4/2025","diasEstimados":60,"diasZonaAustral":1,"empresa":"PRODESUR","etapas":[{"nroEtapa":1,"rangoRaw":"18/4/2025 AL 19/5/2025","fecha_zarpada":"2025-04-18T03:00:00.000Z","fecha_arribo":"2025-05-19T03:00:00.000Z","valido":true}]}
{"nroMarea":56,"buqueName":"ECHIZEN MARU","obsName":"Spagnuolo Rey Leonardo Luis","especieStr":"MERLUZA AUSTRAL","estadoStr":"REALIZADA","zarpadaEstimada":"10/4/2025","diasEstimados":60,"diasZonaAustral":39,"empresa":"PESANTAR","etapas":[{"nroEtapa":1,"rangoRaw":"12/4/2025 AL 20/5/2025","fecha_zarpada":"2025-04-12T03:00:00.000Z","fecha_arribo":"2025-05-20T03:00:00.000Z","valido":true}]}
{"nroMarea":57,"buqueName":"TANGO I","obsName":"Alvarez Gianfranco","especieStr":"CENTOLLA","estadoStr":"REALIZADA","zarpadaEstimada":"9/4/2025","diasEstimados":30,"diasZonaAustral":0,"empresa":"BENTONICOS DE ARGENTINA","etapas":[{"nroEtapa":1,"rangoRaw":"8/5/2025 AL 6/6/2025","fecha_zarpada":"2025-05-08T03:00:00.000Z","fecha_arribo":"2025-06-06T03:00:00.000Z","valido":true}]}
{"nroMarea":58,"buqueName":"VIEIRASA DIECISIETE","obsName":"Godoy Maximiliano Adrian","especieStr":"CALAMAR","estadoStr":"REALIZADA","zarpadaEstimada":"22/4/2025","diasEstimados":30,"diasZonaAustral":0,"empresa":"VIERA ARGENTINA","etapas":[{"nroEtapa":1,"rangoRaw":"21/4/2025AL 15/5/2025","fecha_zarpada":"2025-04-21T03:00:00.000Z","fecha_arribo":"2025-05-15T03:00:00.000Z","valido":true}]}
{"nroMarea":59,"buqueName":"ATLANTIC SURF III","obsName":"Matte Casietto Luciano","especieStr":"VIEIRA","estadoStr":"REALIZADA","zarpadaEstimada":"10/4/2025","diasEstimados":30,"diasZonaAustral":0,"empresa":"GLACIAR PESQUERA","etapas":[{"nroEtapa":1,"rangoRaw":"10/4/2025 AL 6/6/2025","fecha_zarpada":"2025-04-10T03:00:00.000Z","fecha_arribo":"2025-06-06T03:00:00.000Z","valido":true}]}
{"nroMarea":60,"buqueName":"ATLANTIC EXPRESS","obsName":"Reinaga Teresa Beatriz","especieStr":"CENTOLLA","estadoStr":"REALIZADA","zarpadaEstimada":"10/4/2025","diasEstimados":30,"diasZonaAustral":0,"empresa":"WANCHESE ARGENTINA","etapas":[{"nroEtapa":1,"rangoRaw":"12/4/2025 AL 14/5/2025","fecha_zarpada":"2025-04-12T03:00:00.000Z","fecha_arribo":"2025-05-14T03:00:00.000Z","valido":true}]}
{"nroMarea":61,"buqueName":"CAPESANTE","obsName":"Mazzei Alejandro José","especieStr":"VIEIRA","estadoStr":"REALIZADA","zarpadaEstimada":"17/4/2025","diasEstimados":30,"diasZonaAustral":6,"empresa":"GLACIAR PESQUERA","etapas":[{"nroEtapa":1,"rangoRaw":"16/4/2025 AL 29/5/2025","fecha_zarpada":"2025-04-16T03:00:00.000Z","fecha_arribo":"2025-05-29T03:00:00.000Z","valido":true}]}
{"nroMarea":62,"buqueName":"PUENTE VALDES","obsName":"Miranda Pablo Julian","especieStr":"CALAMAR","estadoStr":"REALIZADA","zarpadaEstimada":"15/4/2025","diasEstimados":30,"diasZonaAustral":0,"empresa":"ALTAMARE S.AS","etapas":[{"nroEtapa":1,"rangoRaw":"15/4/2025  AL 27/5/2025","fecha_zarpada":"2025-04-15T03:00:00.000Z","fecha_arribo":"2025-05-27T03:00:00.000Z","valido":true}]}
{"nroMarea":63,"buqueName":"MAR SUR","obsName":"Rodriguez Fulco Estanislao","especieStr":"LANGOSTINO","estadoStr":"REALIZADA","zarpadaEstimada":"11/4/2025","diasEstimados":30,"diasZonaAustral":0,"empresa":"PESCARGEN","etapas":[{"nroEtapa":1,"rangoRaw":"12/4/2025 AL 20/4/2025","fecha_zarpada":"2025-04-12T03:00:00.000Z","fecha_arribo":"2025-04-20T03:00:00.000Z","valido":true},{"nroEtapa":2,"rangoRaw":"21/4/2025 AL 1/5/2025","fecha_zarpada":"2025-04-21T03:00:00.000Z","fecha_arribo":"2025-05-01T03:00:00.000Z","valido":true},{"nroEtapa":3,"rangoRaw":"2/5/2025 AL 10/5/2025","fecha_zarpada":"2025-05-02T03:00:00.000Z","fecha_arribo":"2025-05-10T03:00:00.000Z","valido":true}]}
{"nroMarea":64,"buqueName":"VENTARRON 1º","obsName":"Marchiori Diego Sebastian","especieStr":"MERLUZA","estadoStr":"REALIZADA","zarpadaEstimada":"22/4/2025","diasEstimados":30,"diasZonaAustral":6,"empresa":"GIORNO","etapas":[{"nroEtapa":1,"rangoRaw":"27/4/2025 AL 31/5/2025","fecha_zarpada":"2025-04-27T03:00:00.000Z","fecha_arribo":"2025-05-31T03:00:00.000Z","valido":true}]}
{"nroMarea":65,"buqueName":"ANITA","obsName":"Vera Héctor Eduardo","especieStr":"MERLUZA","estadoStr":"REALIZADA","zarpadaEstimada":"15/4/2025","diasEstimados":30,"diasZonaAustral":0,"empresa":"LUIS SOLIMENO","etapas":[{"nroEtapa":1,"rangoRaw":"21/4/205 AL 29/4/2025","fecha_zarpada":"0205-04-21T03:53:48.000Z","fecha_arribo":"2025-04-29T03:00:00.000Z","valido":true},{"nroEtapa":2,"rangoRaw":"2/5/2025 AL 10/5/2025","fecha_zarpada":"2025-05-02T03:00:00.000Z","fecha_arribo":"2025-05-10T03:00:00.000Z","valido":true},{"nroEtapa":3,"rangoRaw":"12/5/2025 AL 26/5/2025","fecha_zarpada":"2025-05-12T03:00:00.000Z","fecha_arribo":"2025-05-26T03:00:00.000Z","valido":true}]}
{"nroMarea":66,"buqueName":"FEIXA","obsName":"Glavina Walter Alejandro","especieStr":"MERLUZA","estadoStr":"REALIZADA","zarpadaEstimada":"21/4/2025","diasEstimados":30,"diasZonaAustral":0,"empresa":"MARÍTIMA COMERCIAL","etapas":[{"nroEtapa":1,"rangoRaw":"2/5/2025 AL 9/5/2025","fecha_zarpada":"2025-05-02T03:00:00.000Z","fecha_arribo":"2025-05-09T03:00:00.000Z","valido":true},{"nroEtapa":2,"rangoRaw":"14/5/2025 AL 25/5/2025","fecha_zarpada":"2025-05-14T03:00:00.000Z","fecha_arribo":"2025-05-25T03:00:00.000Z","valido":true}]}
{"nroMarea":67,"buqueName":"COALSA SEGUNDO","obsName":"Caballero Nicolas Agustin","especieStr":"MERLUZA","estadoStr":"REALIZADA","zarpadaEstimada":"29/4/2025","diasEstimados":30,"diasZonaAustral":0,"empresa":"NIETOS ANTONIO BALDINO","etapas":[{"nroEtapa":1,"rangoRaw":"30/4/2025 AL 16/6/2025","fecha_zarpada":"2025-04-30T03:00:00.000Z","fecha_arribo":"2025-06-16T03:00:00.000Z","valido":true}]}
{"nroMarea":68,"buqueName":"GRACIELA I","obsName":"Nadal Claudio Alberto","especieStr":"MERLUZA","estadoStr":"REALIZADA","zarpadaEstimada":"23/4/2025","diasEstimados":30,"diasZonaAustral":0,"empresa":"MOSCUZZA","etapas":[{"nroEtapa":1,"rangoRaw":"26/4/2025 AL 4/5/2025","fecha_zarpada":"2025-04-26T03:00:00.000Z","fecha_arribo":"2025-05-04T03:00:00.000Z","valido":true},{"nroEtapa":2,"rangoRaw":"6/5/2025 AL 15/5/2025","fecha_zarpada":"2025-05-06T03:00:00.000Z","fecha_arribo":"2025-05-15T03:00:00.000Z","valido":true},{"nroEtapa":3,"rangoRaw":"17/5/2025 AL 27/5/2025","fecha_zarpada":"2025-05-17T03:00:00.000Z","fecha_arribo":"2025-05-27T03:00:00.000Z","valido":true}]}
{"nroMarea":69,"buqueName":"NANINA","obsName":"Gorosito Diego","especieStr":"CALAMAR","estadoStr":"REALIZADA","zarpadaEstimada":"26/4/2025","diasEstimados":30,"diasZonaAustral":0,"empresa":"MOSCUZZA","etapas":[{"nroEtapa":1,"rangoRaw":"26/4/2025 AL 28/5/2025","fecha_zarpada":"2025-04-26T03:00:00.000Z","fecha_arribo":"2025-05-28T03:00:00.000Z","valido":true}]}
{"nroMarea":70,"buqueName":"ANDRES JORGE","obsName":"Herrera Carlos Daniel","especieStr":"MERLUZA","estadoStr":"REALIZADA","zarpadaEstimada":"25/4/2025","diasEstimados":30,"diasZonaAustral":0,"empresa":"MARONTI  S.A.","etapas":[{"nroEtapa":1,"rangoRaw":"2/5/2025 AL 10/5/2025","fecha_zarpada":"2025-05-02T03:00:00.000Z","fecha_arribo":"2025-05-10T03:00:00.000Z","valido":true},{"nroEtapa":2,"rangoRaw":"12/5/2025 AL 21/5/2025","fecha_zarpada":"2025-05-12T03:00:00.000Z","fecha_arribo":"2025-05-21T03:00:00.000Z","valido":true}]}
{"nroMarea":71,"buqueName":"MINTA","obsName":"Schwartz Fernando Alberto","especieStr":"CALAMAR","estadoStr":"REALIZADA","zarpadaEstimada":"24/4/2025","diasEstimados":30,"diasZonaAustral":0,"empresa":"GRUPO CHIAR PESCA","etapas":[{"nroEtapa":1,"rangoRaw":"30/4/2025 AL 5/6/2025","fecha_zarpada":"2025-04-30T03:00:00.000Z","fecha_arribo":"2025-06-05T03:00:00.000Z","valido":true}]}
{"nroMarea":72,"buqueName":"ARGENOVA XXI","obsName":"Freyre Marcelo Simon","especieStr":"MERLUZA AUSTRAL","estadoStr":"REALIZADA","zarpadaEstimada":"29/4/2025","diasEstimados":30,"diasZonaAustral":24,"empresa":"ARGENOVA","etapas":[{"nroEtapa":1,"rangoRaw":"28/4/2025 AL 4/6/2025","fecha_zarpada":"2025-04-28T03:00:00.000Z","fecha_arribo":"2025-06-04T03:00:00.000Z","valido":true}]}
{"nroMarea":73,"buqueName":"CENTAURO 2000","obsName":"Cerrina Cristian Emmanuel","especieStr":"MERLUZA","estadoStr":"REALIZADA","zarpadaEstimada":"26/4/2025","diasEstimados":30,"diasZonaAustral":0,"empresa":"BUENA PROA","etapas":[{"nroEtapa":1,"rangoRaw":"30/4/2025 AL 6/5/2025","fecha_zarpada":"2025-04-30T03:00:00.000Z","fecha_arribo":"2025-05-06T03:00:00.000Z","valido":true},{"nroEtapa":2,"rangoRaw":"8/5/2025 AL 17/5/2025","fecha_zarpada":"2025-05-08T03:00:00.000Z","fecha_arribo":"2025-05-17T03:00:00.000Z","valido":true},{"nroEtapa":3,"rangoRaw":"22/5/2025 AL 29/5/2025","fecha_zarpada":"2025-05-22T03:00:00.000Z","fecha_arribo":"2025-05-29T03:00:00.000Z","valido":true}]}
{"nroMarea":74,"buqueName":"CERES","obsName":"Staneff Juan Manuel","especieStr":"MERLUZA","estadoStr":"REALIZADA","zarpadaEstimada":"30/4/2025","diasEstimados":30,"diasZonaAustral":7,"empresa":"GIORNO","etapas":[{"nroEtapa":1,"rangoRaw":"29/4/2025 AL 15/5/2025","fecha_zarpada":"2025-04-29T03:00:00.000Z","fecha_arribo":"2025-05-15T03:00:00.000Z","valido":true}]}
{"nroMarea":75,"buqueName":"VALERIA DEL ATLÁNTICO","obsName":"Challier Johnatan","especieStr":"MERLUZA AUSTRAL","estadoStr":"REALIZADA","zarpadaEstimada":"7/5/2025","diasEstimados":30,"diasZonaAustral":0,"empresa":"ESTREMAR","etapas":[{"nroEtapa":1,"rangoRaw":"6/5/2025 AL 18/6/2025","fecha_zarpada":"2025-05-06T03:00:00.000Z","fecha_arribo":"2025-06-18T03:00:00.000Z","valido":true}]}
{"nroMarea":76,"buqueName":"MISS TIDE","obsName":"Villalba Durbal","especieStr":"VIEIRA","estadoStr":"REALIZADA","zarpadaEstimada":"7/5/2025","diasEstimados":30,"diasZonaAustral":0,"empresa":"WANCHESE ARGENTINA","etapas":[{"nroEtapa":1,"rangoRaw":"7/5/2025 AL10/6/2025","fecha_zarpada":"2025-05-07T03:00:00.000Z","fecha_arribo":"2025-06-10T03:00:00.000Z","valido":true}]}
{"nroMarea":77,"buqueName":"GEMINIS","obsName":"Pereyra Nicolas","especieStr":"MERLUZA","estadoStr":"REALIZADA","zarpadaEstimada":"4/5/2025","diasEstimados":30,"diasZonaAustral":0,"empresa":"GIORNO","etapas":[{"nroEtapa":1,"rangoRaw":"2/5/2025 AL 5/6/2025","fecha_zarpada":"2025-05-02T03:00:00.000Z","fecha_arribo":"2025-06-05T03:00:00.000Z","valido":true}]}
{"nroMarea":78,"buqueName":"MATEO I","obsName":"Ramirez Nahuel","especieStr":"CALAMAR","estadoStr":"REALIZADA","zarpadaEstimada":"6/5/2025","diasEstimados":30,"diasZonaAustral":0,"empresa":"FOOD ARTS S.A","etapas":[{"nroEtapa":1,"rangoRaw":"7/5/2025 AL 9/6/2025","fecha_zarpada":"2025-05-07T03:00:00.000Z","fecha_arribo":"2025-06-09T03:00:00.000Z","valido":true}]}
{"nroMarea":79,"buqueName":"NATALIA","obsName":"Garcia Melisa","especieStr":"CALAMAR","estadoStr":"REALIZADA","zarpadaEstimada":"6/5/2025","diasEstimados":30,"diasZonaAustral":0,"empresa":"MOSCUZZA","etapas":[{"nroEtapa":1,"rangoRaw":"7/5/2025 AL 10/6/2025","fecha_zarpada":"2025-05-07T03:00:00.000Z","fecha_arribo":"2025-06-10T03:00:00.000Z","valido":true}]}
{"nroMarea":80,"buqueName":"MAR SUR","obsName":"Noale Claudio","especieStr":"LANGOSTINO","estadoStr":"REALIZADA","zarpadaEstimada":"10/5/2025","diasEstimados":30,"diasZonaAustral":0,"empresa":"PESCAREN S.A","etapas":[{"nroEtapa":1,"rangoRaw":"9/5/2025 AL 19/5/2025","fecha_zarpada":"2025-05-09T03:00:00.000Z","fecha_arribo":"2025-05-19T03:00:00.000Z","valido":true}]}
{"nroMarea":81,"buqueName":"ATLANTIC EXPRESS","obsName":"Gimenez Salinas Gabriel Osvaldo Catriel","especieStr":"CENTOLLA","estadoStr":"REALIZADA","zarpadaEstimada":"15/5/2025","diasEstimados":30,"diasZonaAustral":0,"empresa":"WANCHESE ARGENTINA","etapas":[{"nroEtapa":1,"rangoRaw":"15/5/2025 AL 27/5/2025","fecha_zarpada":"2025-05-15T03:00:00.000Z","fecha_arribo":"2025-05-27T03:00:00.000Z","valido":true}]}
{"nroMarea":82,"buqueName":"ECHIZEN MARU","obsName":"Coppa Juan José","especieStr":"MERLUZA AUSTRAL","estadoStr":"REALIZADA","zarpadaEstimada":"22/5/2025","diasEstimados":60,"diasZonaAustral":50,"empresa":"PESANTAR","etapas":[{"nroEtapa":1,"rangoRaw":"21/05/2025 AL 13/07/25","fecha_zarpada":"2025-05-21T03:00:00.000Z","fecha_arribo":"2025-07-13T03:00:00.000Z","valido":true}]}
{"nroMarea":83,"buqueName":"DON PEDRO","obsName":"Desojo Fabian Eduardo","especieStr":"MERLUZA","estadoStr":"REALIZADA","zarpadaEstimada":"17/5/2025","diasEstimados":30,"diasZonaAustral":0,"empresa":"MOSCUZZA","etapas":[{"nroEtapa":1,"rangoRaw":"17/5/2025 AL 13/7/2025","fecha_zarpada":"2025-05-17T03:00:00.000Z","fecha_arribo":"2025-07-13T03:00:00.000Z","valido":true}]}
{"nroMarea":84,"buqueName":"LUIGI","obsName":"Monterisi María Laura","especieStr":"MERLUZA","estadoStr":"REALIZADA","zarpadaEstimada":"20/5/2025","diasEstimados":30,"diasZonaAustral":0,"empresa":"LUIS SOLIMENO","etapas":[{"nroEtapa":1,"rangoRaw":"22/5/2025 AL 17/6/2025","fecha_zarpada":"2025-05-22T03:00:00.000Z","fecha_arribo":"2025-06-17T03:00:00.000Z","valido":true}]}
{"nroMarea":85,"buqueName":"CERES","obsName":"Staneff Juan Manuel","especieStr":"MERLUZA","estadoStr":"CANCELADA","zarpadaEstimada":"20/5/2025","diasEstimados":30,"diasZonaAustral":null,"empresa":"GIORNO","etapas":[]}
{"nroMarea":86,"buqueName":"SCIROCCO","obsName":"Corti Camila","especieStr":"CALAMAR","estadoStr":"REALIZADA","zarpadaEstimada":"20/5/2025","diasEstimados":30,"diasZonaAustral":0,"empresa":"LUIS SOLIMENO","etapas":[{"nroEtapa":1,"rangoRaw":"22/5/2025 AL 5/6/2025","fecha_zarpada":"2025-05-22T03:00:00.000Z","fecha_arribo":"2025-06-05T03:00:00.000Z","valido":true}]}
{"nroMarea":87,"buqueName":"TAI AN","obsName":"Piriz Cristian Oscar","especieStr":"MERLUZA AUSTRAL","estadoStr":"REALIZADA","zarpadaEstimada":"20/5/2025","diasEstimados":60,"diasZonaAustral":31,"empresa":"PRODESUR","etapas":[{"nroEtapa":1,"rangoRaw":"20/5/2025 AL 21/6/2025","fecha_zarpada":"2025-05-20T03:00:00.000Z","fecha_arribo":"2025-06-21T03:00:00.000Z","valido":true}]}
{"nroMarea":88,"buqueName":"ERIN BRUCE II","obsName":"Di Tullio Daniel Alejandro","especieStr":"VIEIRA","estadoStr":"REALIZADA","zarpadaEstimada":"26/5/2025","diasEstimados":30,"diasZonaAustral":0,"empresa":"WANCHESE ARGENTINA","etapas":[{"nroEtapa":1,"rangoRaw":"27/5/2025 AL 12/7/2025","fecha_zarpada":"2025-05-27T03:00:00.000Z","fecha_arribo":"2025-07-12T03:00:00.000Z","valido":true}]}
{"nroMarea":89,"buqueName":"CAPESANTE","obsName":"Bargas Peña Raul Bernardo","especieStr":"VIEIRA","estadoStr":"REALIZADA","zarpadaEstimada":"31/5/2025","diasEstimados":30,"diasZonaAustral":6,"empresa":"GLACIAR PESQUERA","etapas":[{"nroEtapa":1,"rangoRaw":"31/5/2025 AL 11/7/2025","fecha_zarpada":"2025-05-31T03:00:00.000Z","fecha_arribo":"2025-07-11T03:00:00.000Z","valido":true}]}
{"nroMarea":90,"buqueName":"MAR SUR","obsName":"Rodriguez Fulco Estanislao","especieStr":"LANGOSTINO","estadoStr":"REALIZADA","zarpadaEstimada":"28/5/2025","diasEstimados":30,"diasZonaAustral":0,"empresa":"PESCARGEN","etapas":[{"nroEtapa":1,"rangoRaw":"26/05/2025 AL 3/06/2025","fecha_zarpada":"2025-05-26T03:00:00.000Z","fecha_arribo":"2025-06-03T03:00:00.000Z","valido":true},{"nroEtapa":2,"rangoRaw":"4/06/2025 AL 10/6/2025","fecha_zarpada":"2025-06-04T03:00:00.000Z","fecha_arribo":"2025-06-10T03:00:00.000Z","valido":true}]}
{"nroMarea":91,"buqueName":"NANINA","obsName":"Retamar Mendez Oriana","especieStr":"CALAMAR","estadoStr":"REALIZADA","zarpadaEstimada":"29/5/2025","diasEstimados":30,"diasZonaAustral":0,"empresa":"MOSCUZZA","etapas":[{"nroEtapa":1,"rangoRaw":"31/05/2025 AL 07/06/2025","fecha_zarpada":"2025-05-31T03:00:00.000Z","fecha_arribo":"2025-06-07T03:00:00.000Z","valido":true}]}
{"nroMarea":92,"buqueName":"CONARPESA I","obsName":"Godoy Maximiliano Adrian","especieStr":"LANGOSTINO","estadoStr":"CANCELADA","zarpadaEstimada":"29/5/2025","diasEstimados":30,"diasZonaAustral":null,"empresa":"CONARPESA","etapas":[]}
{"nroMarea":93,"buqueName":"ATLANTIC SURF III","obsName":"Silvester Eduardo","especieStr":"VIERA","estadoStr":"CANCELADA","zarpadaEstimada":"11/6/2025","diasEstimados":30,"diasZonaAustral":null,"empresa":"GLACIAR PESQUERA","etapas":[]}
{"nroMarea":94,"buqueName":"UR ERTZA","obsName":"Cerrina Cristian Emmanuel","especieStr":"MERLUZA","estadoStr":"REALIZADA","zarpadaEstimada":"9/6/2025","diasEstimados":30,"diasZonaAustral":0,"empresa":"ARPES","etapas":[{"nroEtapa":1,"rangoRaw":"12/6/2025 AL 20/6/2025","fecha_zarpada":"2025-06-12T03:00:00.000Z","fecha_arribo":"2025-06-20T03:00:00.000Z","valido":true},{"nroEtapa":2,"rangoRaw":"24/6/2025 AL 5/7/2025","fecha_zarpada":"2025-06-24T03:00:00.000Z","fecha_arribo":"2025-07-05T03:00:00.000Z","valido":true},{"nroEtapa":3,"rangoRaw":"8/7/2025 AL 16/7/2025","fecha_zarpada":"2025-07-08T03:00:00.000Z","fecha_arribo":"2025-07-16T03:00:00.000Z","valido":true},{"nroEtapa":4,"rangoRaw":"19/7/2025 AL 25/7/2025","fecha_zarpada":"2025-07-19T03:00:00.000Z","fecha_arribo":"2025-07-25T03:00:00.000Z","valido":true}]}
{"nroMarea":95,"buqueName":"GEMINIS","obsName":"Glavina Walter Alejandro","especieStr":"MERLUZA","estadoStr":"REALIZADA","zarpadaEstimada":"6/6/2025","diasEstimados":30,"diasZonaAustral":1,"empresa":"GIORNO","etapas":[{"nroEtapa":1,"rangoRaw":"5/6/2025 AL 6/7/2025","fecha_zarpada":"2025-06-05T03:00:00.000Z","fecha_arribo":"2025-07-06T03:00:00.000Z","valido":true}]}
{"nroMarea":96,"buqueName":"VENTARRON 1º","obsName":"Marchiori Diego Sebastian","especieStr":"MERLUZA","estadoStr":"REALIZADA","zarpadaEstimada":"6/6/2025","diasEstimados":30,"diasZonaAustral":0,"empresa":"GIORNO","etapas":[{"nroEtapa":1,"rangoRaw":"5/6/2025 AL 6/7/2025","fecha_zarpada":"2025-06-05T03:00:00.000Z","fecha_arribo":"2025-07-06T03:00:00.000Z","valido":true}]}
{"nroMarea":97,"buqueName":"DON GAETANO","obsName":"Miranda Pablo Julian","especieStr":"MERLUZA","estadoStr":"CANCELADA","zarpadaEstimada":"17/6/2025","diasEstimados":30,"diasZonaAustral":null,"empresa":"ROMFIOC S.R.L","etapas":[]}
{"nroMarea":98,"buqueName":"VALERIA DEL ATLÁNTICO","obsName":"Gorosito Diego","especieStr":"MERLUZA AUSTRAL","estadoStr":"REALIZADA","zarpadaEstimada":"17/6/2025","diasEstimados":30,"diasZonaAustral":0,"empresa":"ESTREMAR","etapas":[{"nroEtapa":1,"rangoRaw":"18/06/2025 AL 3/7/2025","fecha_zarpada":"2025-06-18T03:00:00.000Z","fecha_arribo":"2025-07-03T03:00:00.000Z","valido":true}]}
{"nroMarea":99,"buqueName":"CENTAURO 2000","obsName":"Staneff Rotela Nicolas Facundo","especieStr":"MERLUZA","estadoStr":"REALIZADA","zarpadaEstimada":"12/6/2025","diasEstimados":30,"diasZonaAustral":0,"empresa":"BUENA PROA","etapas":[{"nroEtapa":1,"rangoRaw":"10/6/2025 AL 17/6/2025","fecha_zarpada":"2025-06-10T03:00:00.000Z","fecha_arribo":"2025-06-17T03:00:00.000Z","valido":true},{"nroEtapa":2,"rangoRaw":"19/6/2025 AL 22/6/2025","fecha_zarpada":"2025-06-19T03:00:00.000Z","fecha_arribo":"2025-06-22T03:00:00.000Z","valido":true},{"nroEtapa":3,"rangoRaw":"28/6/2025 AL 4/7/2025","fecha_zarpada":"2025-06-28T03:00:00.000Z","fecha_arribo":"2025-07-04T03:00:00.000Z","valido":true},{"nroEtapa":4,"rangoRaw":"6/7/2025 AL 10/7/2025","fecha_zarpada":"2025-07-06T03:00:00.000Z","fecha_arribo":"2025-07-10T03:00:00.000Z","valido":true},{"nroEtapa":5,"rangoRaw":"12/7/2025 AL 16/7/2025","fecha_zarpada":"2025-07-12T03:00:00.000Z","fecha_arribo":"2025-07-16T03:00:00.000Z","valido":true}]}
{"nroMarea":100,"buqueName":"MISS TIDE","obsName":"Villalba Durbal","especieStr":"VIERA","estadoStr":"CANCELADA","zarpadaEstimada":"17/6/2025","diasEstimados":30,"diasZonaAustral":null,"empresa":"WANCHESE ARGENTINA","etapas":[]}
{"nroMarea":101,"buqueName":"SFIDA","obsName":"Morales Jorge Luis","especieStr":"P. LANGOSTINO","estadoStr":"REALIZADA","zarpadaEstimada":"18/6/2025","diasEstimados":30,"diasZonaAustral":0,"empresa":"BUENA PROA","etapas":[{"nroEtapa":1,"rangoRaw":"18/6/2025 AL 25/6/2025","fecha_zarpada":"2025-06-18T03:00:00.000Z","fecha_arribo":"2025-06-25T03:00:00.000Z","valido":true},{"nroEtapa":2,"rangoRaw":"27/06/2025 AL 11/07/2025","fecha_zarpada":"2025-06-27T03:00:00.000Z","fecha_arribo":"2025-07-11T03:00:00.000Z","valido":true}]}
{"nroMarea":102,"buqueName":"MAR SUR","obsName":"Reinaga Teresa Beatriz","especieStr":"P. LANGOSTINO","estadoStr":"REALIZADA","zarpadaEstimada":"17/6/2025","diasEstimados":30,"diasZonaAustral":0,"empresa":"PESCARGEN","etapas":[{"nroEtapa":1,"rangoRaw":"17/6/2025 AL 10/7/2025","fecha_zarpada":"2025-06-17T03:00:00.000Z","fecha_arribo":"2025-07-10T03:00:00.000Z","valido":true}]}
{"nroMarea":103,"buqueName":"FRANCO","obsName":"Vera Héctor Eduardo","especieStr":"P. LANGOSTINO","estadoStr":"REALIZADA","zarpadaEstimada":"17/6/2025","diasEstimados":30,"diasZonaAustral":0,"empresa":"FRIGORÍFICO DON LUIS","etapas":[{"nroEtapa":1,"rangoRaw":"18/6/2025 AL 25/6/2025","fecha_zarpada":"2025-06-18T03:00:00.000Z","fecha_arribo":"2025-06-25T03:00:00.000Z","valido":true}]}
{"nroMarea":104,"buqueName":"SALVADOR R","obsName":"Noale Claudio","especieStr":"P. LANGOSTINO","estadoStr":"REALIZADA","zarpadaEstimada":"18/6/2025","diasEstimados":30,"diasZonaAustral":0,"empresa":"URLIPEZ","etapas":[{"nroEtapa":1,"rangoRaw":"18/6/2025 AL 25/6/2025","fecha_zarpada":"2025-06-18T03:00:00.000Z","fecha_arribo":"2025-06-25T03:00:00.000Z","valido":true}]}
{"nroMarea":105,"buqueName":"ACRUX","obsName":"Rodriguez Fulco Estanislao","especieStr":"P. LANGOSTINO","estadoStr":"REALIZADA","zarpadaEstimada":"19/6/2025","diasEstimados":30,"diasZonaAustral":0,"empresa":"DE ANGELIS Y LOGGHE","etapas":[{"nroEtapa":1,"rangoRaw":"18/6/2025 AL 25/6/2025","fecha_zarpada":"2025-06-18T03:00:00.000Z","fecha_arribo":"2025-06-25T03:00:00.000Z","valido":true}]}
{"nroMarea":106,"buqueName":"SAN MATIAS","obsName":"Miranda Pablo Julian","especieStr":"P. LANGOSTINO","estadoStr":"REALIZADA","zarpadaEstimada":"17/6/2025","diasEstimados":30,"diasZonaAustral":0,"empresa":"PESCA ANTIGUA","etapas":[{"nroEtapa":1,"rangoRaw":"18/6/2025 AL 25/6/2025","fecha_zarpada":"2025-06-18T03:00:00.000Z","fecha_arribo":"2025-06-25T03:00:00.000Z","valido":true},{"nroEtapa":2,"rangoRaw":"27/6/2025 AL 4/7/2025","fecha_zarpada":"2025-06-27T03:00:00.000Z","fecha_arribo":"2025-07-04T03:00:00.000Z","valido":true}]}
{"nroMarea":107,"buqueName":"API VII","obsName":"Godoy Maximiliano Adrian","especieStr":"MERLUZA","estadoStr":"CANCELADA","zarpadaEstimada":"21/6/2025","diasEstimados":30,"diasZonaAustral":null,"empresa":"IBERCONSA","etapas":[]}
{"nroMarea":108,"buqueName":"ANITA","obsName":"Gimenez Salinas Gabriel Osvaldo Catriel","especieStr":"MERLUZA","estadoStr":"REALIZADA","zarpadaEstimada":"24/6/2025","diasEstimados":30,"diasZonaAustral":0,"empresa":"SOLIMENO E HIJOS","etapas":[{"nroEtapa":1,"rangoRaw":"25/6/2025AL 3/7/2025","fecha_zarpada":"2025-06-25T03:00:00.000Z","fecha_arribo":"2025-07-03T03:00:00.000Z","valido":true},{"nroEtapa":2,"rangoRaw":"5/7/2025 AL 11/7/2025","fecha_zarpada":"2025-07-05T03:00:00.000Z","fecha_arribo":"2025-07-11T03:00:00.000Z","valido":true},{"nroEtapa":3,"rangoRaw":"20/7/2025 AL 26/7/2025","fecha_zarpada":"2025-07-20T03:00:00.000Z","fecha_arribo":"2025-07-26T03:00:00.000Z","valido":true},{"nroEtapa":4,"rangoRaw":"28/7/2025 AL 4/8/2025","fecha_zarpada":"2025-07-28T03:00:00.000Z","fecha_arribo":"2025-08-04T03:00:00.000Z","valido":true}]}
{"nroMarea":109,"buqueName":"ATLANTIC SURF III","obsName":"Martinez Tecco Luis Gabriel","especieStr":"VIERA","estadoStr":"CANCELADA","zarpadaEstimada":"23/6/2025","diasEstimados":30,"diasZonaAustral":null,"empresa":"GLACIAR PESQUERA","etapas":[]}
{"nroMarea":110,"buqueName":"FRANCO","obsName":"Noale Claudio","especieStr":"P. LANGOSTINO","estadoStr":"REALIZADA","zarpadaEstimada":"27/6/2025","diasEstimados":30,"diasZonaAustral":0,"empresa":"FRIGORÍFICO DON LUIS","etapas":[{"nroEtapa":1,"rangoRaw":"27/6/2025 AL 21/7/2025","fecha_zarpada":"2025-06-27T03:00:00.000Z","fecha_arribo":"2025-07-21T03:00:00.000Z","valido":true}]}
{"nroMarea":111,"buqueName":"ACRUX","obsName":"Vera Héctor Eduardo","especieStr":"P. LANGOSTINO","estadoStr":"REALIZADA","zarpadaEstimada":"27/6/2025","diasEstimados":30,"diasZonaAustral":0,"empresa":"DE ANGELIS Y LOGGHE","etapas":[{"nroEtapa":1,"rangoRaw":"27/6/2025 AL 3/7/2025","fecha_zarpada":"2025-06-27T03:00:00.000Z","fecha_arribo":"2025-07-03T03:00:00.000Z","valido":true},{"nroEtapa":2,"rangoRaw":"4/7/2025 AL 11/7/2025","fecha_zarpada":"2025-07-04T03:00:00.000Z","fecha_arribo":"2025-07-11T03:00:00.000Z","valido":true}]}
{"nroMarea":112,"buqueName":"NONO PASCUAL","obsName":"Alvarez Gianfranco","especieStr":"P. LANGOSTINO","estadoStr":"REALIZADA","zarpadaEstimada":"27/6/2025","diasEstimados":30,"diasZonaAustral":0,"empresa":"CANAL DE BEAGLE","etapas":[{"nroEtapa":1,"rangoRaw":"27/6/2025 AL 17/7/2025","fecha_zarpada":"2025-06-27T03:00:00.000Z","fecha_arribo":"2025-07-17T03:00:00.000Z","valido":true}]}
{"nroMarea":113,"buqueName":"ATREVIDO","obsName":"Schwartz Fernando Alberto","especieStr":"MERLUZA","estadoStr":"REALIZADA","zarpadaEstimada":"1/7/2025","diasEstimados":30,"diasZonaAustral":0,"empresa":"PESQUERA VERAZ","etapas":[{"nroEtapa":1,"rangoRaw":"12/7/2025 AL 14/7/2025","fecha_zarpada":"2025-07-12T03:00:00.000Z","fecha_arribo":"2025-07-14T03:00:00.000Z","valido":true},{"nroEtapa":2,"rangoRaw":"18/7/2025 AL 23/7/2025","fecha_zarpada":"2025-07-18T03:00:00.000Z","fecha_arribo":"2025-07-23T03:00:00.000Z","valido":true},{"nroEtapa":3,"rangoRaw":"27/7/2025 AL 1/8/2025","fecha_zarpada":"2025-07-27T03:00:00.000Z","fecha_arribo":"2025-08-01T03:00:00.000Z","valido":true}]}
{"nroMarea":114,"buqueName":"ATLANTIC SURF III","obsName":"Martinez Tecco Luis Gabriel","especieStr":"VIERA","estadoStr":"REALIZADA","zarpadaEstimada":"10/7/2025","diasEstimados":30,"diasZonaAustral":0,"empresa":"GLACIAR PESQUERA","etapas":[{"nroEtapa":1,"rangoRaw":"10/7/2025 AL 29/8/2025","fecha_zarpada":"2025-07-10T03:00:00.000Z","fecha_arribo":"2025-08-29T03:00:00.000Z","valido":true}]}
{"nroMarea":115,"buqueName":"MISS TIDE","obsName":"Villalba Durbal","especieStr":"VIERA","estadoStr":"CANCELADA","zarpadaEstimada":"8/7/2025","diasEstimados":30,"diasZonaAustral":null,"empresa":"WANCHESE ARGENTINA","etapas":[]}
{"nroMarea":116,"buqueName":"CAPESANTE","obsName":"Piriz Cristian Oscar","especieStr":"VIERA","estadoStr":"REALIZADA","zarpadaEstimada":"15/7/2025","diasEstimados":30,"diasZonaAustral":3,"empresa":"GLACIAR PESQUERA","etapas":[{"nroEtapa":1,"rangoRaw":"14/7/2025 AL 28/8/2025","fecha_zarpada":"2025-07-14T03:00:00.000Z","fecha_arribo":"2025-08-28T03:00:00.000Z","valido":true}]}
{"nroMarea":117,"buqueName":"MAR SUR","obsName":"Reinaga Teresa Beatriz","especieStr":"LANGOSTINO","estadoStr":"REALIZADA","zarpadaEstimada":"11/7/2025","diasEstimados":30,"diasZonaAustral":0,"empresa":"PESCARGEN","etapas":[{"nroEtapa":1,"rangoRaw":"11/7/2025 AL 20/8/2025","fecha_zarpada":"2025-07-11T03:00:00.000Z","fecha_arribo":"2025-08-20T03:00:00.000Z","valido":true}]}
{"nroMarea":118,"buqueName":"DON SANTIAGO","obsName":"Garcia Federico Nicolás","especieStr":"LANGOSTINO","estadoStr":"REALIZADA","zarpadaEstimada":"11/7/2025","diasEstimados":30,"diasZonaAustral":0,"empresa":"BUENA PROA","etapas":[{"nroEtapa":1,"rangoRaw":"13/7/2025 AL 5/8/2025","fecha_zarpada":"2025-07-13T03:00:00.000Z","fecha_arribo":"2025-08-05T03:00:00.000Z","valido":true}]}
{"nroMarea":119,"buqueName":"VERDEL","obsName":"Challier Johnatan","especieStr":"MERLUZA","estadoStr":"REALIZADA","zarpadaEstimada":"12/7/2025","diasEstimados":30,"diasZonaAustral":0,"empresa":"IBERCONSA","etapas":[{"nroEtapa":1,"rangoRaw":"12/7/2025 AL 23/8/2025","fecha_zarpada":"2025-07-12T03:00:00.000Z","fecha_arribo":"2025-08-23T03:00:00.000Z","valido":true}]}
{"nroMarea":120,"buqueName":"NIÑO JESUS DE PRAGA","obsName":"Caballero Nicolas Agustin","especieStr":"LANGOSTINO","estadoStr":"CANCELADA","zarpadaEstimada":"11/7/2025","diasEstimados":30,"diasZonaAustral":null,"empresa":"RITONDO SALLUSTIO Y CICCIOTTI","etapas":[]}
{"nroMarea":121,"buqueName":"JOSE MARCELO","obsName":"Mazzei Alejandro José","especieStr":"LANGOSTINO","estadoStr":"REALIZADA","zarpadaEstimada":"15/7/2025","diasEstimados":30,"diasZonaAustral":0,"empresa":"MOSCUZZA","etapas":[{"nroEtapa":1,"rangoRaw":"18/7/2025 AL 25/7/2025","fecha_zarpada":"2025-07-18T03:00:00.000Z","fecha_arribo":"2025-07-25T03:00:00.000Z","valido":true},{"nroEtapa":2,"rangoRaw":"26/7/2025 AL 3/8/2025","fecha_zarpada":"2025-07-26T03:00:00.000Z","fecha_arribo":"2025-08-03T03:00:00.000Z","valido":true},{"nroEtapa":3,"rangoRaw":"4/8/2025 AL 10/8/2025","fecha_zarpada":"2025-08-04T03:00:00.000Z","fecha_arribo":"2025-08-10T03:00:00.000Z","valido":true},{"nroEtapa":4,"rangoRaw":"11/8/2025 AL 17/8/2025","fecha_zarpada":"2025-08-11T03:00:00.000Z","fecha_arribo":"2025-08-17T03:00:00.000Z","valido":true}]}
{"nroMarea":122,"buqueName":"ERIN BRUCE II","obsName":"Di Tullio Daniel Alejandro","especieStr":"VIEIRA","estadoStr":"REALIZADA","zarpadaEstimada":"16/7/2025","diasEstimados":30,"diasZonaAustral":0,"empresa":"WANCHESE ARGENTINA","etapas":[{"nroEtapa":1,"rangoRaw":"17/7/2025 AL 4/9/2025","fecha_zarpada":"2025-07-17T03:00:00.000Z","fecha_arribo":"2025-09-04T03:00:00.000Z","valido":true}]}
{"nroMarea":123,"buqueName":"VENTARRON 1º","obsName":"Marchiori Diego Sebastian","especieStr":"MERLUZA","estadoStr":"CANCELADA","zarpadaEstimada":"19/7/2025","diasEstimados":30,"diasZonaAustral":null,"empresa":"GIORNO S.A","etapas":[]}
{"nroMarea":124,"buqueName":"GEMINIS","obsName":"Glavina Walter Alejandro","especieStr":"MERLUZA","estadoStr":"REALIZADA","zarpadaEstimada":"19/7/2025","diasEstimados":30,"diasZonaAustral":0,"empresa":"GIORNO S.A","etapas":[{"nroEtapa":1,"rangoRaw":"19/7/2025 al 19/8/2025","fecha_zarpada":"2025-07-19T03:00:00.000Z","fecha_arribo":"2025-08-19T03:00:00.000Z","valido":true}]}
{"nroMarea":125,"buqueName":"CONARPESA I","obsName":"Caballero Nicolas Agustin","especieStr":"LANGOSTINO","estadoStr":"CANCELADA","zarpadaEstimada":"18/7/2025","diasEstimados":30,"diasZonaAustral":null,"empresa":"CONARPESA","etapas":[]}
{"nroMarea":126,"buqueName":"CENTAURO 2000","obsName":"Ramirez Nahuel","especieStr":"LANGOSTINO","estadoStr":"CANCELADA","zarpadaEstimada":"18/7/2025","diasEstimados":30,"diasZonaAustral":null,"empresa":"BUENA PROA","etapas":[]}
{"nroMarea":127,"buqueName":"ANTONIO ALVAREZ","obsName":"Gorosito Diego","especieStr":"LANGOSTINO","estadoStr":"CANCELADA","zarpadaEstimada":"18/7/2025","diasEstimados":30,"diasZonaAustral":null,"empresa":"CONARPESA","etapas":[]}
{"nroMarea":128,"buqueName":"ITXAS LUR","obsName":"Staneff Juan Manuel","especieStr":"MERLUZA","estadoStr":"REALIZADA","zarpadaEstimada":"18/7/2025","diasEstimados":30,"diasZonaAustral":0,"empresa":"PEDRO MOSCUZZA E HIJO","etapas":[{"nroEtapa":1,"rangoRaw":"19/7/2025 AL 23/8/2025","fecha_zarpada":"2025-07-19T03:00:00.000Z","fecha_arribo":"2025-08-23T03:00:00.000Z","valido":true}]}
{"nroMarea":129,"buqueName":"GRACIELA I","obsName":"Alvarez Gianfranco","especieStr":"LANGOSTINO","estadoStr":"REALIZADA","zarpadaEstimada":"21/7/2025","diasEstimados":30,"diasZonaAustral":null,"empresa":"PEDRO MOSCUZZA E HIJO","etapas":[]}
{"nroMarea":130,"buqueName":"API VII","obsName":"Villalba Durbal","especieStr":"LANGOSTINO","estadoStr":"CANCELADA","zarpadaEstimada":"22/7/2025","diasEstimados":30,"diasZonaAustral":null,"empresa":"IBERCONSA","etapas":[]}
{"nroMarea":131,"buqueName":"EMPESUR VII","obsName":"Garcia Sebastían Roque","especieStr":"LANGOSTINO","estadoStr":"CANCELADA","zarpadaEstimada":"22/7/2025","diasEstimados":30,"diasZonaAustral":null,"empresa":"EMPESUR","etapas":[]}
{"nroMarea":132,"buqueName":"PEDRITO","obsName":"Freyre Marcelo Simon","especieStr":"LANGOSTINO","estadoStr":"REALIZADA","zarpadaEstimada":"23/7/2025","diasEstimados":30,"diasZonaAustral":0,"empresa":"BUENOS AIRES PESCA S.A","etapas":[{"nroEtapa":1,"rangoRaw":"23/7/2025 AL 7/10/2025","fecha_zarpada":"2025-07-23T03:00:00.000Z","fecha_arribo":"2025-10-07T03:00:00.000Z","valido":true}]}
{"nroMarea":133,"buqueName":"SAN JUAN B","obsName":"Marchiori Diego Sebastian","especieStr":"LANGOSTINO","estadoStr":"REALIZADA","zarpadaEstimada":"23/7/2025","diasEstimados":30,"diasZonaAustral":0,"empresa":"BUENOS AIRES PESCA S.A","etapas":[{"nroEtapa":1,"rangoRaw":"23/7/2025 AL 27/9/2025","fecha_zarpada":"2025-07-23T03:00:00.000Z","fecha_arribo":"2025-09-27T03:00:00.000Z","valido":true}]}
{"nroMarea":134,"buqueName":"CENTAURO 2000","obsName":"Caballero Nicolas Agustin","especieStr":"LANGOSTINO","estadoStr":"REALIZADA","zarpadaEstimada":"25/7/2025","diasEstimados":30,"diasZonaAustral":0,"empresa":"BUENA PROA","etapas":[{"nroEtapa":1,"rangoRaw":"24/7/2025 AL 30/8/2025","fecha_zarpada":"2025-07-24T03:00:00.000Z","fecha_arribo":"2025-08-30T03:00:00.000Z","valido":true}]}
{"nroMarea":135,"buqueName":"UR ERTZA","obsName":"Godoy Maximiliano Adrian","especieStr":"MERLUZA","estadoStr":"REALIZADA","zarpadaEstimada":"27/7/2025","diasEstimados":30,"diasZonaAustral":0,"empresa":"ARPES","etapas":[{"nroEtapa":1,"rangoRaw":"29/7/2025 AL 3/8/2025","fecha_zarpada":"2025-07-29T03:00:00.000Z","fecha_arribo":"2025-08-03T03:00:00.000Z","valido":true},{"nroEtapa":2,"rangoRaw":"6/8/2025 AL 14/8/2025","fecha_zarpada":"2025-08-06T03:00:00.000Z","fecha_arribo":"2025-08-14T03:00:00.000Z","valido":true},{"nroEtapa":3,"rangoRaw":"16/8/2025 AL 23/8/2025","fecha_zarpada":"2025-08-16T03:00:00.000Z","fecha_arribo":"2025-08-23T03:00:00.000Z","valido":true}]}
{"nroMarea":136,"buqueName":"CHIYO MARU Nº 3","obsName":"Silvester Eduardo","especieStr":"CENTOLLA","estadoStr":"REALIZADA","zarpadaEstimada":"28/7/2025","diasEstimados":60,"diasZonaAustral":42,"empresa":"CRUSTACEOS DEL SUR S.A","etapas":[{"nroEtapa":1,"rangoRaw":"29/7/2025 AL 13/9/2025","fecha_zarpada":"2025-07-29T03:00:00.000Z","fecha_arribo":"2025-09-13T03:00:00.000Z","valido":true}]}
{"nroMarea":137,"buqueName":"LUCA SANTINO","obsName":"Miranda Pablo Julian","especieStr":"LANGOSTINO","estadoStr":"REALIZADA","zarpadaEstimada":"29/7/2025","diasEstimados":30,"diasZonaAustral":0,"empresa":"CENTOMAR S.A","etapas":[{"nroEtapa":1,"rangoRaw":"30/7/2025 AL 4/8/2025","fecha_zarpada":"2025-07-30T03:00:00.000Z","fecha_arribo":"2025-08-04T03:00:00.000Z","valido":true}]}
{"nroMarea":138,"buqueName":"DESTINY","obsName":"Gorosito Diego","especieStr":"LANGOSTINO","estadoStr":"REALIZADA","zarpadaEstimada":"4/8/2025","diasEstimados":30,"diasZonaAustral":0,"empresa":"WANCHESE ARGENTINA","etapas":[{"nroEtapa":1,"rangoRaw":"4/8/2025 AL 14/8/2025","fecha_zarpada":"2025-08-04T03:00:00.000Z","fecha_arribo":"2025-08-14T03:00:00.000Z","valido":true},{"nroEtapa":2,"rangoRaw":"15/8/2025 AL 7/9/2025","fecha_zarpada":"2025-08-15T03:00:00.000Z","fecha_arribo":"2025-09-07T03:00:00.000Z","valido":true}]}
{"nroMarea":139,"buqueName":"DON SANTIAGO","obsName":"Staneff Rotela Nicolas Facundo","especieStr":"LANGOSTINO","estadoStr":"REALIZADA","zarpadaEstimada":"2/8/2025","diasEstimados":30,"diasZonaAustral":0,"empresa":"BUENA PROA","etapas":[{"nroEtapa":1,"rangoRaw":"1/8/2025 AL 23/8/2025","fecha_zarpada":"2025-08-01T03:00:00.000Z","fecha_arribo":"2025-08-23T03:00:00.000Z","valido":true}]}
{"nroMarea":140,"buqueName":"ARBUMASA XIX","obsName":"Noale Claudio","especieStr":"LANGOSTINO","estadoStr":"REALIZADA","zarpadaEstimada":"5/8/2025","diasEstimados":30,"diasZonaAustral":0,"empresa":"ARBUMASA S.A","etapas":[{"nroEtapa":1,"rangoRaw":"3/8/2025 AL 23/8/2025","fecha_zarpada":"2025-08-03T03:00:00.000Z","fecha_arribo":"2025-08-23T03:00:00.000Z","valido":true}]}
{"nroMarea":141,"buqueName":"ARBUMASA XV","obsName":"Rodriguez Fulco Estanislao","especieStr":"LANGOSTINO","estadoStr":"REALIZADA","zarpadaEstimada":"5/8/2025","diasEstimados":30,"diasZonaAustral":0,"empresa":"ARBUMASA S.A","etapas":[{"nroEtapa":1,"rangoRaw":"5/8/2025 AL 13/8/2025","fecha_zarpada":"2025-08-05T03:00:00.000Z","fecha_arribo":"2025-08-13T03:00:00.000Z","valido":true}]}
{"nroMarea":142,"buqueName":"VIRGEN MARIA","obsName":"Garcia Sebastían Roque","especieStr":"MERLUZA","estadoStr":"REALIZADA","zarpadaEstimada":"6/8/2025","diasEstimados":30,"diasZonaAustral":0,"empresa":"SOLIMENO E HIJOS","etapas":[{"nroEtapa":1,"rangoRaw":"7/8/2025 AL 14/08/2025","fecha_zarpada":"2025-08-07T03:00:00.000Z","fecha_arribo":"2025-08-14T03:00:00.000Z","valido":true},{"nroEtapa":2,"rangoRaw":"20/8/2025 AL 27/8/2025","fecha_zarpada":"2025-08-20T03:00:00.000Z","fecha_arribo":"2025-08-27T03:00:00.000Z","valido":true},{"nroEtapa":3,"rangoRaw":"29/8/2025 AL 5/9/2025","fecha_zarpada":"2025-08-29T03:00:00.000Z","fecha_arribo":"2025-09-05T03:00:00.000Z","valido":true},{"nroEtapa":4,"rangoRaw":"8/9/2025 AL 16/9/2025","fecha_zarpada":"2025-09-08T03:00:00.000Z","fecha_arribo":"2025-09-16T03:00:00.000Z","valido":true}]}
{"nroMarea":143,"buqueName":"NINA","obsName":"Miranda Pablo Julian","especieStr":"LANGOSTINO","estadoStr":"REALIZADA","zarpadaEstimada":"7/8/2025","diasEstimados":30,"diasZonaAustral":0,"empresa":"PEDRO MOSCUZZA E HIJO","etapas":[{"nroEtapa":1,"rangoRaw":"8/8/2025 AL 24/9/2025","fecha_zarpada":"2025-08-08T03:00:00.000Z","fecha_arribo":"2025-09-24T03:00:00.000Z","valido":true}]}
{"nroMarea":144,"buqueName":"JOSÉ AMÉRICO","obsName":"Spagnuolo Rey Leonardo Luis","especieStr":"LANGOSTINO","estadoStr":"REALIZADA","zarpadaEstimada":"7/8/2025","diasEstimados":30,"diasZonaAustral":0,"empresa":"PEDRO MOSCUZZA E HIJO","etapas":[{"nroEtapa":1,"rangoRaw":"7/8/2025 AL 23/9/2025","fecha_zarpada":"2025-08-07T03:00:00.000Z","fecha_arribo":"2025-09-23T03:00:00.000Z","valido":true}]}
{"nroMarea":145,"buqueName":"MELLINO VI","obsName":"Ramirez Nahuel","especieStr":"MERLUZA","estadoStr":"REALIZADA","zarpadaEstimada":"12/8/2025","diasEstimados":30,"diasZonaAustral":0,"empresa":"ANTONIO BALDINO E HIJOS","etapas":[{"nroEtapa":1,"rangoRaw":"14/8/2025 AL 22/8/2025","fecha_zarpada":"2025-08-14T03:00:00.000Z","fecha_arribo":"2025-08-22T03:00:00.000Z","valido":true},{"nroEtapa":2,"rangoRaw":"26/8/2025 AL 5/9/2025","fecha_zarpada":"2025-08-26T03:00:00.000Z","fecha_arribo":"2025-09-05T03:00:00.000Z","valido":true},{"nroEtapa":3,"rangoRaw":"9/9/2025 AL 9/9/2025","fecha_zarpada":"2025-09-09T03:00:00.000Z","fecha_arribo":"2025-09-09T03:00:00.000Z","valido":true},{"nroEtapa":4,"rangoRaw":"13/9/2025 AL 23/9/2025","fecha_zarpada":"2025-09-13T03:00:00.000Z","fecha_arribo":"2025-09-23T03:00:00.000Z","valido":true}]}
{"nroMarea":146,"buqueName":"ANDRES JORGE","obsName":"Cerrina Cristian Emmanuel","especieStr":"MERLUZA","estadoStr":"REALIZADA","zarpadaEstimada":"14/8/2025","diasEstimados":30,"diasZonaAustral":0,"empresa":"MARONTI  S.A.","etapas":[{"nroEtapa":1,"rangoRaw":"16/8/2025 AL 25/8/2025","fecha_zarpada":"2025-08-16T03:00:00.000Z","fecha_arribo":"2025-08-25T03:00:00.000Z","valido":true},{"nroEtapa":2,"rangoRaw":"28/8/2025 AL 6/9/2025","fecha_zarpada":"2025-08-28T03:00:00.000Z","fecha_arribo":"2025-09-06T03:00:00.000Z","valido":true},{"nroEtapa":3,"rangoRaw":"8/9/2025 AL 18/9/2025","fecha_zarpada":"2025-09-08T03:00:00.000Z","fecha_arribo":"2025-09-18T03:00:00.000Z","valido":true}]}
{"nroMarea":147,"buqueName":"GEMINIS","obsName":"Matte Casietto Luciano","especieStr":"MERLUZA","estadoStr":"REALIZADA","zarpadaEstimada":"19/8/2025","diasEstimados":30,"diasZonaAustral":0,"empresa":"GIORNO S.A","etapas":[{"nroEtapa":1,"rangoRaw":"22/8/2025 AL 22/9/2025","fecha_zarpada":"2025-08-22T03:00:00.000Z","fecha_arribo":"2025-09-22T03:00:00.000Z","valido":true}]}
{"nroMarea":148,"buqueName":"MARIA ALEJANDRA 1º","obsName":"Morales Jorge Luis","especieStr":"LANGOSTINO","estadoStr":"REALIZADA","zarpadaEstimada":"18/8/2025","diasEstimados":30,"diasZonaAustral":0,"empresa":"XEITOSIÑO","etapas":[{"nroEtapa":1,"rangoRaw":"19/8/2025 AL 31/8/2025","fecha_zarpada":"2025-08-19T03:00:00.000Z","fecha_arribo":"2025-08-31T03:00:00.000Z","valido":true}]}
{"nroMarea":149,"buqueName":"XEITOSIÑO","obsName":"Villalba Durbal","especieStr":"LANGOSTINO","estadoStr":"REALIZADA","zarpadaEstimada":"19/8/2025","diasEstimados":30,"diasZonaAustral":0,"empresa":"XEITOSIÑO","etapas":[{"nroEtapa":1,"rangoRaw":"20/8/2025 AL 18/9/2025","fecha_zarpada":"2025-08-20T03:00:00.000Z","fecha_arribo":"2025-09-18T03:00:00.000Z","valido":true}]}
{"nroMarea":150,"buqueName":"DON JUAN ALVAREZ","obsName":"Reinaga Teresa Beatriz","especieStr":"LANGOSTINO","estadoStr":"REALIZADA","zarpadaEstimada":"25/8/2025","diasEstimados":30,"diasZonaAustral":0,"empresa":"CONARPESA","etapas":[{"nroEtapa":1,"rangoRaw":"25/8/2025 AL 7/9/2025","fecha_zarpada":"2025-08-25T03:00:00.000Z","fecha_arribo":"2025-09-07T03:00:00.000Z","valido":true}]}
{"nroMarea":151,"buqueName":"CERES","obsName":"Schwartz Fernando Alberto","especieStr":"LANGOSTINO","estadoStr":"CANCELADA","zarpadaEstimada":"29/8/2025","diasEstimados":30,"diasZonaAustral":0,"empresa":"GIORNO","etapas":[{"nroEtapa":1,"rangoRaw":"30/8/2025 AL 30/8/2025","fecha_zarpada":"2025-08-30T03:00:00.000Z","fecha_arribo":"2025-08-30T03:00:00.000Z","valido":true}]}
{"nroMarea":152,"buqueName":"FEDERICO C","obsName":"Rodriguez Fulco Estanislao","especieStr":"LANGOSTINO","estadoStr":"REALIZADA","zarpadaEstimada":"29/8/2025","diasEstimados":30,"diasZonaAustral":0,"empresa":"PESQUERA VERAZ SA","etapas":[{"nroEtapa":1,"rangoRaw":"31/8/2025 AL 8/10/2025","fecha_zarpada":"2025-08-31T03:00:00.000Z","fecha_arribo":"2025-10-08T03:00:00.000Z","valido":true}]}
{"nroMarea":153,"buqueName":"ITXAS LUR","obsName":"Coppa Juan José","especieStr":"MERLUZA","estadoStr":"REALIZADA","zarpadaEstimada":"30/8/2025","diasEstimados":30,"diasZonaAustral":0,"empresa":"PEDRO MOSCUZZA E HIJO","etapas":[{"nroEtapa":1,"rangoRaw":"30/8/2025 AL 6/10/2025","fecha_zarpada":"2025-08-30T03:00:00.000Z","fecha_arribo":"2025-10-06T03:00:00.000Z","valido":true}]}
{"nroMarea":154,"buqueName":"ARGENOVA XXII","obsName":"Staneff Juan Manuel","especieStr":"LANGOSTINO","estadoStr":"REALIZADA","zarpadaEstimada":"5/9/2025","diasEstimados":30,"diasZonaAustral":0,"empresa":"ARGENOVA S.A","etapas":[{"nroEtapa":1,"rangoRaw":"4/9/2025 AL 16/9/2025","fecha_zarpada":"2025-09-04T03:00:00.000Z","fecha_arribo":"2025-09-16T03:00:00.000Z","valido":true}]}
{"nroMarea":155,"buqueName":"ERIN BRUCE II","obsName":"Bargas Peña Raul Bernardo","especieStr":"VIEIRA","estadoStr":"REALIZADA","zarpadaEstimada":"8/9/2025","diasEstimados":30,"diasZonaAustral":0,"empresa":"WANCHESE ARGENTINA","etapas":[{"nroEtapa":1,"rangoRaw":"10/9/2025 AL 20/10/2025","fecha_zarpada":"2025-09-10T03:00:00.000Z","fecha_arribo":"2025-10-20T03:00:00.000Z","valido":true}]}
{"nroMarea":156,"buqueName":"CHIYO MARU Nº 3","obsName":"Herrera Jorge Guillermo","especieStr":"CENTOLLA","estadoStr":"REALIZADA","zarpadaEstimada":"11/9/2025","diasEstimados":30,"diasZonaAustral":0,"empresa":"CRUSTACEOS DEL SUR S.A","etapas":[{"nroEtapa":1,"rangoRaw":"11/9/2025 AL 1/10/2025","fecha_zarpada":"2025-09-11T03:00:00.000Z","fecha_arribo":"2025-10-01T03:00:00.000Z","valido":true}]}
{"nroMarea":157,"buqueName":"LUCA MARIO","obsName":"Glavina Walter Alejandro","especieStr":"MERLUZA","estadoStr":"REALIZADA","zarpadaEstimada":"10/9/2025","diasEstimados":30,"diasZonaAustral":0,"empresa":"PESCASOL S.A","etapas":[{"nroEtapa":1,"rangoRaw":"11/09/2025 AL 18/10/2025","fecha_zarpada":"2025-09-11T03:00:00.000Z","fecha_arribo":"2025-10-18T03:00:00.000Z","valido":true}]}
{"nroMarea":158,"buqueName":"ARBUMASA XV","obsName":"Schwartz Fernando Alberto","especieStr":"LANGOSTINO","estadoStr":"REALIZADA","zarpadaEstimada":"13/9/2025","diasEstimados":30,"diasZonaAustral":0,"empresa":"ARBUMASA S.A","etapas":[{"nroEtapa":1,"rangoRaw":"13/09/2025 AL 13/10/2025","fecha_zarpada":"2025-09-13T03:00:00.000Z","fecha_arribo":"2025-10-13T03:00:00.000Z","valido":true}]}
{"nroMarea":159,"buqueName":"ATLANTIC EXPRESS","obsName":"Aguilar Alexia","especieStr":"CENTOLLA","estadoStr":"REALIZADA","zarpadaEstimada":"11/9/2025","diasEstimados":30,"diasZonaAustral":0,"empresa":"WANCHESE ARGENTINA","etapas":[{"nroEtapa":1,"rangoRaw":"14/10/2025 AL 8/11/2025","fecha_zarpada":"2025-10-14T03:00:00.000Z","fecha_arribo":"2025-11-08T03:00:00.000Z","valido":true}]}
{"nroMarea":160,"buqueName":"TALISMAN","obsName":"Godoy Maximiliano Adrian","especieStr":"CENTOLLA","estadoStr":"REALIZADA","zarpadaEstimada":"11/9/2025","diasEstimados":30,"diasZonaAustral":0,"empresa":"CENTOMAR S.A","etapas":[{"nroEtapa":1,"rangoRaw":"15/10/2025 AL 8/11/2025","fecha_zarpada":"2025-10-15T03:00:00.000Z","fecha_arribo":"2025-11-08T03:00:00.000Z","valido":true}]}
{"nroMarea":161,"buqueName":"TANGO II","obsName":"Gimenez Salinas Gabriel Osvaldo Catriel","especieStr":"CENTOLLA","estadoStr":"REALIZADA","zarpadaEstimada":"11/9/2025","diasEstimados":30,"diasZonaAustral":0,"empresa":"BENTONICOS DE ARGENTINA","etapas":[{"nroEtapa":1,"rangoRaw":"11/10/2025 AL 21/12/2025","fecha_zarpada":"2025-10-11T03:00:00.000Z","fecha_arribo":"2025-12-21T03:00:00.000Z","valido":true}]}
{"nroMarea":162,"buqueName":"TANGO I","obsName":"Corti Camila","especieStr":"CENTOLLA","estadoStr":"REALIZADA","zarpadaEstimada":"11/9/2025","diasEstimados":30,"diasZonaAustral":0,"empresa":"BENTONICOS DE ARGENTINA","etapas":[{"nroEtapa":1,"rangoRaw":"11/10/2025 AL 7/12/2025","fecha_zarpada":"2025-10-11T03:00:00.000Z","fecha_arribo":"2025-12-07T03:00:00.000Z","valido":true}]}
{"nroMarea":163,"buqueName":"ECHIZEN MARU","obsName":"Mazzei Alejandro José","especieStr":"MERLUZA AUSTRAL","estadoStr":"REALIZADA","zarpadaEstimada":"17/9/2025","diasEstimados":30,"diasZonaAustral":61,"empresa":"PESANTAR","etapas":[{"nroEtapa":1,"rangoRaw":"16/9/2025 AL 19/11/2025","fecha_zarpada":"2025-09-16T03:00:00.000Z","fecha_arribo":"2025-11-19T03:00:00.000Z","valido":true}]}
{"nroMarea":164,"buqueName":"XEITOSIÑO","obsName":"Villalba Durbal","especieStr":"LANGOSTINO","estadoStr":"REALIZADA","zarpadaEstimada":"19/9/2025","diasEstimados":30,"diasZonaAustral":0,"empresa":"XEITOSIÑO","etapas":[{"nroEtapa":1,"rangoRaw":"19/9/2025 AL 7/10/2025","fecha_zarpada":"2025-09-19T03:00:00.000Z","fecha_arribo":"2025-10-07T03:00:00.000Z","valido":true}]}
{"nroMarea":165,"buqueName":"VALERIA DEL ATLÁNTICO","obsName":"Troccoli Gonzalo","especieStr":"MERLUZA AUSTRAL","estadoStr":"REALIZADA","zarpadaEstimada":"29/9/2025","diasEstimados":30,"diasZonaAustral":31,"empresa":"ESTREMAR","etapas":[{"nroEtapa":1,"rangoRaw":"29/9/2025 AL 30/10/2025","fecha_zarpada":"2025-09-29T03:00:00.000Z","fecha_arribo":"2025-10-30T03:00:00.000Z","valido":true}]}
{"nroMarea":166,"buqueName":"ARGENOVA XXI","obsName":"Gorosito Diego","especieStr":"MERLUZA AUSTRAL","estadoStr":"REALIZADA","zarpadaEstimada":"29/9/2025","diasEstimados":30,"diasZonaAustral":0,"empresa":"ARGENOVA","etapas":[{"nroEtapa":1,"rangoRaw":"28/9/2025 AL 7/11/2025","fecha_zarpada":"2025-09-28T03:00:00.000Z","fecha_arribo":"2025-11-07T03:00:00.000Z","valido":true}]}
{"nroMarea":167,"buqueName":"ATREVIDO","obsName":"Cerrina Cristian Emmanuel","especieStr":"MERLUZA","estadoStr":"REALIZADA","zarpadaEstimada":"26/9/2025","diasEstimados":30,"diasZonaAustral":0,"empresa":"PESQUERA VERAZ S.A","etapas":[{"nroEtapa":1,"rangoRaw":"30/9/2025 AL 5/10/2025","fecha_zarpada":"2025-09-30T03:00:00.000Z","fecha_arribo":"2025-10-05T03:00:00.000Z","valido":true},{"nroEtapa":2,"rangoRaw":"7/10/2025 AL 12/10/25","fecha_zarpada":"2025-10-07T03:00:00.000Z","fecha_arribo":"2025-10-12T03:00:00.000Z","valido":true},{"nroEtapa":3,"rangoRaw":"14/10/25 AL 18/10/25","fecha_zarpada":"2025-10-14T03:00:00.000Z","fecha_arribo":"2025-10-18T03:00:00.000Z","valido":true},{"nroEtapa":4,"rangoRaw":"20/10/25 AL 24/10/25","fecha_zarpada":"2025-10-20T03:00:00.000Z","fecha_arribo":"2025-10-24T03:00:00.000Z","valido":true},{"nroEtapa":5,"rangoRaw":"26/10/25 AL 31/10/25","fecha_zarpada":"2025-10-26T03:00:00.000Z","fecha_arribo":"2025-10-31T03:00:00.000Z","valido":true},{"nroEtapa":6,"rangoRaw":"1/11/25 AL 9/11/25","fecha_zarpada":"2025-11-01T03:00:00.000Z","fecha_arribo":"2025-11-09T03:00:00.000Z","valido":true}]}
{"nroMarea":168,"buqueName":"ITXAS LUR","obsName":"Miranda Pablo Julian","especieStr":"MERLUZA","estadoStr":"REALIZADA","zarpadaEstimada":"14/10/2025","diasEstimados":30,"diasZonaAustral":0,"empresa":"PEDRO MOSCUZZA E HIJO","etapas":[{"nroEtapa":1,"rangoRaw":"14/10/2025 AL 23/11/2025","fecha_zarpada":"2025-10-14T03:00:00.000Z","fecha_arribo":"2025-11-23T03:00:00.000Z","valido":true}]}
{"nroMarea":169,"buqueName":"DUKAT","obsName":"Challier Johnatan","especieStr":"CENTOLLA","estadoStr":"REALIZADA","zarpadaEstimada":"12/10/2025","diasEstimados":60,"diasZonaAustral":0,"empresa":"CRUSTACEOS DEL SUR S.A","etapas":[{"nroEtapa":1,"rangoRaw":"11/10/2025 AL 7/12/2025","fecha_zarpada":"2025-10-11T03:00:00.000Z","fecha_arribo":"2025-12-07T03:00:00.000Z","valido":true}]}
{"nroMarea":170,"buqueName":"CENTAURO 2000","obsName":"Spagnuolo Rey Leonardo Luis","especieStr":"MERLUZA","estadoStr":"REALIZADA","zarpadaEstimada":"18/10/2025","diasEstimados":30,"diasZonaAustral":0,"empresa":"BUENA PROA","etapas":[{"nroEtapa":1,"rangoRaw":"19/10/2025 AL 23/10/2025","fecha_zarpada":"2025-10-19T03:00:00.000Z","fecha_arribo":"2025-10-23T03:00:00.000Z","valido":true},{"nroEtapa":2,"rangoRaw":"24/10/2025 AL 29/10/25","fecha_zarpada":"2025-10-24T03:00:00.000Z","fecha_arribo":"2025-10-29T03:00:00.000Z","valido":true},{"nroEtapa":3,"rangoRaw":"3/11/2025 AL 10/11/25","fecha_zarpada":"2025-11-03T03:00:00.000Z","fecha_arribo":"2025-11-10T03:00:00.000Z","valido":true}]}
{"nroMarea":171,"buqueName":"CAPESANTE","obsName":"Silvester Eduardo","especieStr":"VIEIRA","estadoStr":"REALIZADA","zarpadaEstimada":"30/10/2025","diasEstimados":60,"diasZonaAustral":6,"empresa":"GLACIAR PESQUERA","etapas":[{"nroEtapa":1,"rangoRaw":"30/10/2025 AL 11/12/2025","fecha_zarpada":"2025-10-30T03:00:00.000Z","fecha_arribo":"2025-12-11T03:00:00.000Z","valido":true}]}
{"nroMarea":172,"buqueName":"CHIYO MARU Nº 3","obsName":"Herrera Jorge Guillermo","especieStr":"CENTOLLA","estadoStr":"REALIZADA","zarpadaEstimada":"23/10/2025","diasEstimados":30,"diasZonaAustral":30,"empresa":"CRUSTACEOS DEL SUR S.A","etapas":[{"nroEtapa":1,"rangoRaw":"23/10/2025 AL 26/11/2025","fecha_zarpada":"2025-10-23T03:00:00.000Z","fecha_arribo":"2025-11-26T03:00:00.000Z","valido":true}]}
{"nroMarea":173,"buqueName":"VALERIA DEL ATLÁNTICO","obsName":"Aguilar Eduardo Esteban","especieStr":"MERLUZA AUSTRAL","estadoStr":"REALIZADA","zarpadaEstimada":"29/9/2025","diasEstimados":30,"diasZonaAustral":22,"empresa":"ESTREMAR","etapas":[{"nroEtapa":1,"rangoRaw":"29/10/2025 AL 20/11/2025","fecha_zarpada":"2025-10-29T03:00:00.000Z","fecha_arribo":"2025-11-20T03:00:00.000Z","valido":true}]}
{"nroMarea":174,"buqueName":"ERIN BRUCE II","obsName":"Matte Casietto Luciano","especieStr":"VIEIRA","estadoStr":"REALIZADA","zarpadaEstimada":"27/10/2025","diasEstimados":30,"diasZonaAustral":0,"empresa":"WANCHESE ARGENTINA","etapas":[{"nroEtapa":1,"rangoRaw":"27/10/2025 AL 07/12/2025","fecha_zarpada":"2025-10-27T03:00:00.000Z","fecha_arribo":"2025-12-07T03:00:00.000Z","valido":true}]}
{"nroMarea":175,"buqueName":"ANITA","obsName":"Nadal Claudio Alberto","especieStr":"MERLUZA","estadoStr":"REALIZADA","zarpadaEstimada":"31/10/2025","diasEstimados":30,"diasZonaAustral":0,"empresa":"SOLIMENO e HIJOS S.A","etapas":[{"nroEtapa":1,"rangoRaw":"4/11/2025 AL 12/11/25","fecha_zarpada":"2025-11-04T03:00:00.000Z","fecha_arribo":"2025-11-12T03:00:00.000Z","valido":true},{"nroEtapa":2,"rangoRaw":"14/11/25 AL 18/11/25","fecha_zarpada":"2025-11-14T03:00:00.000Z","fecha_arribo":"2025-11-18T03:00:00.000Z","valido":true},{"nroEtapa":3,"rangoRaw":"22/11/25 AL 27/11/25","fecha_zarpada":"2025-11-22T03:00:00.000Z","fecha_arribo":"2025-11-27T03:00:00.000Z","valido":true},{"nroEtapa":4,"rangoRaw":"30/11/25 AL 6/12/25","fecha_zarpada":"2025-11-30T03:00:00.000Z","fecha_arribo":"2025-12-06T03:00:00.000Z","valido":true}]}
{"nroMarea":176,"buqueName":"MELLINO VI","obsName":"Herrera Carlos Daniel","especieStr":"MERLUZA","estadoStr":"REALIZADA","zarpadaEstimada":"1/11/2025","diasEstimados":30,"diasZonaAustral":0,"empresa":"ROTELLO S.A","etapas":[{"nroEtapa":1,"rangoRaw":"1/11/2025 AL 12/11/2025","fecha_zarpada":"2025-11-01T03:00:00.000Z","fecha_arribo":"2025-11-12T03:00:00.000Z","valido":true}]}
{"nroMarea":177,"buqueName":"UR ERTZA","obsName":"Staneff Juan Manuel","especieStr":"MERLUZA","estadoStr":"REALIZADA","zarpadaEstimada":"3/11/2025","diasEstimados":30,"diasZonaAustral":0,"empresa":"ARPES S.A","etapas":[{"nroEtapa":1,"rangoRaw":"3/11/25 AL 12/11/25","fecha_zarpada":"2025-11-03T03:00:00.000Z","fecha_arribo":"2025-11-12T03:00:00.000Z","valido":true},{"nroEtapa":2,"rangoRaw":"14/11/25 AL 21/11/25","fecha_zarpada":"2025-11-14T03:00:00.000Z","fecha_arribo":"2025-11-21T03:00:00.000Z","valido":true},{"nroEtapa":3,"rangoRaw":"23/11/25 AL 01/12/25","fecha_zarpada":"2025-11-23T03:00:00.000Z","fecha_arribo":"2025-12-01T03:00:00.000Z","valido":true},{"nroEtapa":4,"rangoRaw":"03/12/25 AL 11/12/25","fecha_zarpada":"2025-12-03T03:00:00.000Z","fecha_arribo":"2025-12-11T03:00:00.000Z","valido":true}]}
{"nroMarea":178,"buqueName":"TALISMAN","obsName":"Caballero Nicolas Agustin","especieStr":"CENTOLLA","estadoStr":"REALIZADA","zarpadaEstimada":"6/11/2025","diasEstimados":30,"diasZonaAustral":null,"empresa":"CENTOMAR S.A","etapas":[{"nroEtapa":1,"rangoRaw":"07/11/2025 AL 25/11/2025","fecha_zarpada":"2025-11-07T03:00:00.000Z","fecha_arribo":"2025-11-25T03:00:00.000Z","valido":true},{"nroEtapa":2,"rangoRaw":"28/11/2025 AL 21/12/2025","fecha_zarpada":"2025-11-28T03:00:00.000Z","fecha_arribo":"2025-12-21T03:00:00.000Z","valido":true}]}
{"nroMarea":179,"buqueName":"RAFFAELA","obsName":"Staneff Rotela Nicolas Facundo","especieStr":"ANCHOÍTA","estadoStr":"REALIZADA","zarpadaEstimada":"4/11/2025","diasEstimados":30,"diasZonaAustral":0,"empresa":"AIRE MARINO","etapas":[{"nroEtapa":1,"rangoRaw":"4/11/2025 AL 11/11/2025","fecha_zarpada":"2025-11-04T03:00:00.000Z","fecha_arribo":"2025-11-11T03:00:00.000Z","valido":true}]}
{"nroMarea":180,"buqueName":"ATLANTIC EXPRESS","obsName":"Reinaga Teresa Beatriz","especieStr":"CENTOLLA","estadoStr":"REALIZADA","zarpadaEstimada":"10/11/2025","diasEstimados":30,"diasZonaAustral":0,"empresa":"WANCHESE ARGENTINA","etapas":[{"nroEtapa":1,"rangoRaw":"12/11/2025 AL 24/12/2025","fecha_zarpada":"2025-11-12T03:00:00.000Z","fecha_arribo":"2025-12-24T03:00:00.000Z","valido":true}]}
{"nroMarea":181,"buqueName":"MISS TIDE","obsName":"Villalba Durbal","especieStr":"VIEIRA","estadoStr":"REALIZADA","zarpadaEstimada":"10/11/2025","diasEstimados":30,"diasZonaAustral":0,"empresa":"WANCHESE ARGENTINA","etapas":[{"nroEtapa":1,"rangoRaw":"10/11/2025 AL 12/12/2025","fecha_zarpada":"2025-11-10T03:00:00.000Z","fecha_arribo":"2025-12-12T03:00:00.000Z","valido":true}]}
{"nroMarea":182,"buqueName":"ECHIZEN MARU","obsName":"Staneff Rotela Nicolas Facundo","especieStr":"MERLUZA AUSTRAL","estadoStr":"NAVEGANDO","zarpadaEstimada":"20/11/2025","diasEstimados":30,"diasZonaAustral":null,"empresa":"PESANTAR","etapas":[]}
{"nroMarea":183,"buqueName":"CHIYO MARU Nº 3","obsName":"Coppa Juan José","especieStr":"CENTOLLA","estadoStr":"NAVEGANDO","zarpadaEstimada":"20/11/2025","diasEstimados":30,"diasZonaAustral":null,"empresa":"CRUSTACEOS DEL SUR S.A","etapas":[]}
{"nroMarea":184,"buqueName":"TAI AN","obsName":"Freyre Marcelo Simon","especieStr":"MERLUZA AUSTRAL","estadoStr":"NAVEGANDO","zarpadaEstimada":"26/11/2025","diasEstimados":60,"diasZonaAustral":null,"empresa":"PRODESUR","etapas":[]}
{"nroMarea":185,"buqueName":"ATREVIDO","obsName":"Espinola Gysin Richard Javier","especieStr":"MERLUZA","estadoStr":"REALIZADA","zarpadaEstimada":"1/12/2025","diasEstimados":30,"diasZonaAustral":0,"empresa":"PESQUERA VERAZ S.A","etapas":[{"nroEtapa":1,"rangoRaw":"01/12/2025 AL 16/12/2025","fecha_zarpada":"2025-12-01T03:00:00.000Z","fecha_arribo":"2025-12-16T03:00:00.000Z","valido":true}]}
{"nroMarea":186,"buqueName":"CAPESANTE","obsName":"Silvester Eduardo","especieStr":"VIEIRA","estadoStr":"NAVEGANDO","zarpadaEstimada":"15/12/2025","diasEstimados":30,"diasZonaAustral":null,"empresa":"GLACIAR PESQUERA","etapas":[]}
{"nroMarea":187,"buqueName":"ERIN BRUCE II","obsName":"Garcia Sebastían Roque","especieStr":"VIEIRA","estadoStr":"NAVEGANDO","zarpadaEstimada":"15/12/2025","diasEstimados":30,"diasZonaAustral":null,"empresa":"WANCHESE ARGENTINA","etapas":[]}
{"nroMarea":188,"buqueName":"VALERIA DEL ATLÁNTICO","obsName":"Glavina Walter Alejandro","especieStr":"MERLUZA AUSTRAL","estadoStr":"A LA ESPERA","zarpadaEstimada":"29/12/2025","diasEstimados":30,"diasZonaAustral":null,"empresa":"ESTREMAR S.A","etapas":[]}
{"nroMarea":189,"buqueName":"MINTA","obsName":"Gomez Mapiz Sergio Javier","especieStr":"CALAMAR","estadoStr":"A LA ESPERA","zarpadaEstimada":"26/12/2025","diasEstimados":30,"diasZonaAustral":null,"empresa":"CHIARPESCA","etapas":[]}
{"nroMarea":190,"buqueName":"SOHO MARU Nº 58","obsName":"Ramirez Nahuel","especieStr":"CALAMAR","estadoStr":"A LA ESPERA","zarpadaEstimada":"29/12/2025","diasEstimados":30,"diasZonaAustral":null,"empresa":"ARGENOVA","etapas":[]}
{"nroMarea":191,"buqueName":"HUYU 962","obsName":"Gaona Lucas Oscar","especieStr":"CALAMAR","estadoStr":"A LA ESPERA","zarpadaEstimada":"29/12/2025","diasEstimados":30,"diasZonaAustral":null,"empresa":"ALTAMARE S.AS","etapas":[]}
{"nroMarea":192,"buqueName":"Hai Xiang 16","obsName":"Schwartz Fernando Alberto","especieStr":"CALAMAR","estadoStr":"A LA ESPERA","zarpadaEstimada":"26/12/2025","diasEstimados":30,"diasZonaAustral":null,"empresa":"PESQUERÍA  RÍO QUEQUEN","etapas":[]}
{"nroMarea":193,"buqueName":"Hai Xiang 17","obsName":"Rodriguez Fulco Juan Francisco","especieStr":"CALAMAR","estadoStr":"A LA ESPERA","zarpadaEstimada":"26/12/2025","diasEstimados":30,"diasZonaAustral":null,"empresa":"PESQUERÍA  RÍO QUEQUEN","etapas":[]}
{"nroMarea":194,"buqueName":"TALISMAN","obsName":"Sette Francisco German","especieStr":"CENTOLLA","estadoStr":"A LA ESPERA","zarpadaEstimada":"26/12/2025","diasEstimados":30,"diasZonaAustral":null,"empresa":"CENTOMAR S.A","etapas":[]}
{"nroMarea":195,"buqueName":"DUKAT","obsName":"Ledesma Morena Aylen","especieStr":"CENTOLLA","estadoStr":"A LA ESPERA","zarpadaEstimada":"30/12/2025","diasEstimados":30,"diasZonaAustral":null,"empresa":"CRUSTACEOS DEL SUR S.A","etapas":[]}
{"nroMarea":196,"buqueName":"TANGO II","obsName":"Molina Riquelme Daiana Anabella","especieStr":"CENTOLLA","estadoStr":"NAVEGANDO","zarpadaEstimada":"23/12/2025","diasEstimados":30,"diasZonaAustral":null,"empresa":"BENTONICOS DE ARGENTINA","etapas":[]}
{"nroMarea":197,"buqueName":"TANGO I","obsName":"Mazzei Alejandro José","especieStr":"CENTOLLA","estadoStr":"A LA ESPERA","zarpadaEstimada":"30/12/2025","diasEstimados":30,"diasZonaAustral":null,"empresa":"BENTONICOS DE ARGENTINA","etapas":[]}
{"nroMarea":198,"buqueName":"DON LUIS I","obsName":"Espinola Gysin Richard Javier","especieStr":"CALAMAR","estadoStr":"A LA ESPERA","zarpadaEstimada":"29/12/2025","diasEstimados":30,"diasZonaAustral":null,"empresa":"GIORNO","etapas":[]}
{"nroMarea":199,"buqueName":"ATLANTIC SURF III","obsName":"Bargas Peña Raul Bernardo","especieStr":"VIEIRA","estadoStr":"A LA ESPERA","zarpadaEstimada":"26/12/2025","diasEstimados":30,"diasZonaAustral":null,"empresa":"GLACIAR PESQUERA","etapas":[]}
{"nroMarea":200,"buqueName":"SCIROCCO","obsName":"Navarro Grassi Paola Alejandra","especieStr":"CALAMAR","estadoStr":"A LA ESPERA","zarpadaEstimada":"28/12/2025","diasEstimados":30,"diasZonaAustral":null,"empresa":"LUIS SOLIMENO","etapas":[]}
{"nroMarea":201,"buqueName":"NAVEGANTES III","obsName":"Carabeta Lucas David","especieStr":"CALAMAR","estadoStr":"A LA ESPERA","zarpadaEstimada":"28/12/2025","diasEstimados":30,"diasZonaAustral":null,"empresa":"PESQUERA COMERCIAL","etapas":[]}